,tweet_bersih
0,qatar university umum kamar tempat lionel messi gelar piala dunia ubah museum mini kampus kamp timnas argentina piala dunia kemarin
1,puan maharani harap gelar piala dunia qatar jalan lancar puan harap rakyat
2,stadion mewah canggih piala dunia qatar sri mulyani mama awards
3,kah chudlori gus dur piala dunia qatar gus youtube
9,kylian mbappe bangkit gagal piala dunia qatar
10,argentina doooooooong min
12,saksi bisu piala dunia kamar lionel messi qatar sulap museum mini
13,kamar messi qatar ubah museum
14,mini museum kelola qatar university mess basecamp timnas gelar piala dunia jadi kamar leo messi museum mini ya gambar kamar timnas argentina leo messi qatar
15,saksi bisu sejarah piala dunia kamar lionel messi qatar sulap museum mini
17,kabar barat fenomena orangorang beli bidetsemprotan pulang qatar pasca tonton piala dunia
18,dunia
19,cetak gol tua piala dunia saja messi ronaldo sports
20,masuk akal fifa atur argentina juara piala dunia piala dunia qatar baik
21,prediksi piala aff timnas indonesia vs thailand desember link claim bonus deposit deposit pulsa potong
22,messi dewa kamar hotel kapten timnas argentina piala dunia qatar museum
23,kamar lionel messi inap piala dunia jadi museum
24,stadion mewah canggih piala dunia qatar
25,wni volunteer piala dunia qatar duta bangsa
26,argentina juara pinalti prancis bapuk piala dunia selenggara qatar salah mas gibran
27,stadion piala dunia qatar bahan bekas baifern kendali imei
28,kamar hotel messi piala dunia qatar ubah museum
29,gilir amerika syarikat tuan rumah lantang buruk qatar tanding rekod
30,besar gaji piala dunia qatar
32,congratulations argentina hasil juara fifa world cup qatar piala dunia vamous argentina sukses main baik nya lionel messi vamous
33,pulang benzema jelang laga perdana piala dunia picu polemik
34,piala dunia qatar nobat piala dunia baik abad
35,ayam burger king qatar piala dunia
36,pilih qatar tuan rumah piala dunia timbul publik pasal qatar catat buruk kait isu hak asasi manusia qatar pilih tuan rumah piala dunia
37,ubah tahap layak piala asia amp piala dunia asing gabung rantau saing peringkat benua top piala asia piala dunia idea pulang badan bolasepak jurang rapat qatar bukti
38,stadion piala dunia qatar bahan bekas nia ramadhani hobi
39,qatar voting suara tempat piala dunia qatar piala dunia baik abad
40,stadion mewah canggih piala dunia qatar nia ramadhani hobi
41,lusail kota besar qatar letak pesisir selatan provinsi al daayen tuan rumah piala dunia perintah qatar rombak lusail dana miliar dollar amerika serikat
43,hasil voting nobat piala dunia qatar baik abad
44,bongkar stadion sepak bola piala dunia stadion ras abu aboud doha qatar hebat sistem knock down bangun tab
46,kamar hotel lionel messi tidur piala dunia jadi museum
49,survei bbc sport pilih piala dunia qatar piala dunia baik abad nih kawan tuju
50,thinkfast stadium piala dunia qatar labuh tirai balik hangat lawan bola sepak tanding stadium uni acara bola sepak
51,qatar yuk min piala dunia euforia asa
52,piala dunia pilih piala dunia baik abad guna internet bbc qatar jepun korea selatan brazil jerman rusia afrika selatan
53,hasil qatar selenggara piala dunia ubah imaji global cenderung negatif bangsa masyarakat arab
56,nice kalo anak masuk sejarah suruh bikin skripsi dampak piala dunia qatar sistem cebok dunia barat
58,qatar university jadi kamar inap messi piala dunia museum
59,jadwal tanding tanggal amp desember informasi hubung wa
60,kamar tidur kapten timnas argentina lionel messi piala dunia ubah museum qatar university
61,
62,kenang gegap gempita piala dunia qatar sih fokusnyah
67,presiden turki recep tayyip erdo an komentar kiprah cristiano ronaldo piala dunia qatar turut ronaldo cadang alas politik piala dunia marak dukung palestina ronaldo main bela palestina
68,jungkook dreamers music from the fifa world cup qatar official soundtrack urut lagu nih iyupss jungkook bts cetak sejarah lagu tema piala dunia fifa judul dreamers
70,piala dunia qatar pilih piala dunia baik abad survei bbc sport suara urut piala dunia jepangkorea selatan suara brasil jerman
72,check out topi logo prancis piala dunia qatar nyamadiskon rpdapatkan lazada
73,check out cod baru topi piala dunia qatar putidiskon rpdapatkan lazada
74,lionel messi catat rekor pribadi susul menang argentina piala dunia qatar saja capai
75,piala dunia qatar nobat piala dunia baik hingar bingar piala dunia pesta olahraga skala global rampung laksana piala dunia fifa qatar nobat piala dunia baik
76,laga perdana manchester united pasca piala dunia qatar live sctv wajib poin
77,pasca piala dunia stadion qatar dialihfungsikan bongkar
78,rekomendasi situs aplikasi livescore orangorang suka sepak bola salah olahraga populer dunia bukti piala dunia gelar qatar saksi juta tonton
79,tiru selebrasi hakim piala dunia qatar
80,gemerlap aksi bintang sepakbola dunia manja mata cinta penjuru dunia pilih qatar raguragu gelontor ribu triliun laksana piala dunia qatar
81,stadion piala dunia qatar bahan bekas
82,sarjana ugm asli anak indramayu percaya urus indah stadion piala dunia qatar baca lengkap share download aplikasi rcti baca berita lengkap
83,piala dunia qatar pilih piala dunia baik abad survei bbc sport suara
84,hakim ziyech milik kisah tarik bantu maroko semifinal piala dunia qatar
85,alexis mac allister main turun irlandia bantu timnas argentina juara piala dunia qatar
86,media gemar korea selatan nikmat piala aff piala dunia qatar cakup persen populasi dunia asia tenggara pasar tarik negara
89,gokils fifa mod world cup qatar android offline grafik hd new kits amp squad piala dunia
91,main baik piala dunia qatar messi bola emas mbappe sepatu emas
92,perancis juara piala dunia qatar kalah argentina drama adu pinalti
93,piala dunia qatar habis juara argentina detik bilang piala dunia qatar setinggan argentina messi ulang hadeeeeh yaudah sih ya tinggal tunggu piala dunia
95,emiliano martinez bincang bantu timnas argentina juara piala dunia qatar
96,lionel messi disebutsebut lengkap trofi hasil menang jalan karier bantu timnas argentina juara piala dunia qatar kalah prancis partai final
97,prediksi bola desember situs taruh bola percaya amp lengkap pola
99,esra selvia alumni telu pesta sepak bola besar dunia world cup esra salah wakil indonesia tampil opening closing ceremony piala dunia qatar
100,prediksi manchester united vs nottingham forest desember link claim bonus deposit deposit pulsa potong
101,liverpool langkah cepat main belanda cody gakpo gakpo main solid piala dunia qatar cetak gol tanding kabar liverpool kalah manchester united chelsea buru gakpo
102,final piala dunia qatar pekan main minggu argentina nobat kampiun piala dunia kalah prancis drama adu penalti
103,liverpool tikung manchester united buru cody gakpo main timnas belanda moncer piala dunia qatar selang gabung the reds
110,liverpool resmi dapat cody gakpo psv eindhoven sinar belanda piala dunia qatar unjuk gigi premier league
113,maroko semi final piala dunia qatar coba cek deh twibbonize maroko semi final piala dunia qatar link part
114,liverpool sikat aston villa laga buka lanjut liga inggris piala dunia qatar
116,rto agen betting slot lengkap provider baik deposit dp pulsa tana potong main geme rto link daftar
117,info bola tampil mario aji paruh musim moto sportalavista mario aji satusatunya balap muda indonesia sempat tampil ajang balap motor
118,prediksi indonesia matchday liga premier inggris musim manchester united vs nottingham forest
119,jadwal tanding sepakbola selasa desember rabu desember wib
123,media berita inggris bbc muat berita negatif qatar opening ceremony piala dunia siar kali bbc sport ada polling piala dunia baik abad hasil netizen pilih piala dunia qatar baik
124,bijak qatar piala dunia sesuai ideologi negara
126,daftar lengkap main buruk piala dunia qatar simak infografis lengkap
127,rasa ya momen gua sih kayak momen piala dunia qatar juara piala dunia kali argentina gua lupa momen tahum
129,bicara dunia sepak bola argentina jago raih trofi piala dunia koneksi internet negara lionel messi kalah telak qatar
130,v janelt brentford cetak gol liga inggris jeda piala dunia qatar
131,alam unik tarik piala dunia qatar
132,main underrated piala dunia qatar
133,masya allah mantan atheis prancis masuk islam tonton piala dunia qatar
134,piala dunia fifa qatar argentina juara liga perdana inggeris epl purapura lupa arsenal persada liga
135,tite kabar rampok jalan gagal bawa brazil lolos semi final piala dunia qatar
137,liga premier inggris gulir jeda piala dunia qatar desember kemarin boxing day tradisi tanding libur natal pemainpemain liga inggris krusial
139,sembah takjub maghribi pentas piala dunia qatar barubaru inspirasi haq
140,rekor messi piala dunia qatar umur bugar rekor kejar messi podcast stroberi
141,wasit final piala dunia aku salah rugi prancis untung argentina salah simak video ya sports
142,ton kroos sebut cristiano ronaldo baik dunia kroos kes performa lionel messi piala dunia
144,prediksi mix parlay liga dunia desember klik link
145,argentina juara piala dunia qatar bantu dukun liput
146,qatar sumbang bus piala dunia lebanon
147,conte protes liga inggris gulir cepat piala dunia qatar
148,laga final baik lupa sejarah piala dunia sports
149,aguero daftar asisten latih argentina world cup qatar resmi milik medali piala dunia hak raya squad argentina cerita media sok take a note guys
150,leo messi hormat rasa budaya arab pakai jubah bisht qatar lepas tawar
153,selamat menang event piala dunia qatar info klaim sila hubung tim marketing
154,aksi timnas jepang piala dunia qatar kemarin hebat banget versi animenya kalah keren penasaran kayak sih langsung cek deh
156,wasit var final piala dunia balas kritik fan prancis
158,piala dunia qatar piala dunia jadwal mepet banget siap pulih premier league main capek
160,gol salto richarlison gawang serbia pilih gol baik turnamen piala dunia fifa qatar sepakat pilih
161,kapai stats mbappe trophies piala dunia messi mbappe tim psg mbappe bawa pildun main senior dibandingin main muda sesat nama wkkw
162,manajer tottenham antonio conte senang premier league gulir delapan final piala dunia lengkap
163,problem gua perkara trofi piala dunia piala dunia musim nama piala dunia qatar piala dunia qatar musim dasar trofi piala dunia status head head musim
166,mantan masuk islam tonton
169,piala dunia qatar menang tentu panitia bubar akun bola koar
170,maroko cetak sejarah gelar piala dunia qatar tumbang cristiano ronaldo dkk babak empat final
172,momen lucu lupa piala dunia sports
174,piala dunia qatar selesai sedih tonton sepak bola catat senin desember jumat januari liga inggris nonstop saji tanding jadwal boxing day moji tv sctv vidio
175,qatar maroko gapai sukses diplomasi piala dunia
177,tite mundur brasil bidik jose mourinho latih
179,prediksi indonesia matchday liga premier inggris musim arsenal vs west ham united
180,prediksi indonesia matchday liga premier inggris musim aston villa vs liverpool
181,jadwal tanding sepakbola senin desember selasa desember wib
182,piala dunia fifa qatar raya ragam budaya toleransi koeksistensi damai
183,gelar individu messi mpv sih bukti tanding piala dunia nya messi gelar tim copa mpv finalissima mpv fwc qatar mpv debatin njing
185,skill messi piala dunia qatar beautiful dribbling skills goals amp assists messi skill
186,skill neymar piala dunia qatar full dribbling skills goals amp assists
188,ungkap wasit final szymon marciniak aku salah laku pimpin laga vs qatar salah lengkap
190,sadar calum chambers masuk timnas england piala dunia qatar
195,wanita tekad topless argentina hasil kalah perancis piala dunia qatar
196,brentford vs tottenham conte istirahat bintang piala dunia qatar
198,pesta buka megah tutup riah catat manis qatar tuan rumah piala dunia lionel messi nanti juara argentina gelar piala dunia pertama
199,negara qatar sukses selenggara pesta akbar sepak bola tahun piala dunia tuan rumah negara sepak bola negeri jazirah arab sumber dana batas sulap gurun pasir tandus stadion megah
200,negara qatar sukses selenggara piala dunia tuan rumah negara sepak bola negeri jazirah arab sulap gurun pasir tandus stadion megah hasil bangga tuan rumah qatar
202,dominasi wags patah emak pialadunia qatar
203,smtm catat rating tv rendah sejarah show me the money rating smtm ratarata persen rendah season season rating rendah pengaruh smtm tayang bareng piala dunia qatar
204,juara piala dunia messi sejajar pele maradona
205,strategi qatar kenal ajar islam piala dunia
207,rekor hasil pecah lionel messi gelar piala dunia qatar lionel andr s messi ladies and gentlemen
210,vidio fifa world cup qatar tonton tayang kontenkonten piala dunia livestreaming highlight amp siar ulang tanding world cup
211,piala dunia qatar selesai minggu terima kasih qatar stadion hotel hotel megah selamat argentina hasil menang piala dunia qatar
212,ulang piala dunia qatar nya jungkook perform dreamers argentina menang final gue deh kangen
213,legenda liverpool emiliano martinez malu negara
214,menang argentina piala dunia bukti debat baik messi vs ronaldo jawab jawab nasib kerja migran bangun fasilitas qatar tinggal capai orang
215,piala dunia harihari normal qatar jumpa piala follow instagram facebook ekingsnews
216,duel argentina vs perancis piala dunia nilai final baik sejarah piala dunia
217,usaha nasional boy thohir saksi langsung final piala dunia stadion lusail qatar desember
218,presiden liberia george weah ngantor alas kunker negeri pergok tonton piala dunia qatar anak bela timnas as
219,qatar kerap serta budaya arab islam ajang piala dunia
220,enner valencia cetak gol piala dunia qatar laga timnas ekuador vs qatar
221,kalo euro pildun juara euro masuk final piala dunia juara euro masuk pildun
222,penyalamatan baik piala dunia fifa qatar
223,info bola kevinmarcus menang bwf championship sportalavista pasang ganda putra andal indonesia kevin sanjayamarcus gideon selesai tanding round bwf
224,negara qatar sukses selenggara piala dunia tuan rumah negara sepak bola negeri jazirah arab sumber dana batas sulap gurun pasir tandus stadion megah
225,esai opini piala dunia qatar argentina manusia sila klik
226,desi rame tuh suasana final sepak bola piala dunia qatar sungguh ajaib dunia barat waras kaum kafir tonton bola miras mmng asik mnyenangkan nyaman aman seru
229,pesta menang piala dunia argentina jalan ricuh
234,gol akrobatik richarlison gawang serbia nobat gol baik piala dunia
238,piala dunia fifa rusia nigeria peringkat kumpul piala dunia fifa qatar arab saudi peringkat kumpul mexico peringkat kumpul australia pusing baik
239,tanding sepak penalti piala yb hee loy sian sember ahad stadium kajang anjur tanding sepak penalti sempena musim piala dunia qatar sember pagi petang stadium kajang
240,ya ya rendah selbrasi golden glove dap menang piala dunia qatar
241,jadwal tanding sepakbola minggu desember senin desember wib
242,minggu pasca fwc ter ter ter piala dunia tulis opini pribadi perihal piala dunia pildun baik istimewa thread
244,geliat timtim medioker kembali dewa sepak bola piala dunia qatar juara argentina salah tim favorit piala dunia penuh kejut via
250,ton kroos nilai main buruk piala dunia gelandang jerman tertawa geli tampil qatar
252,potret couple main argentina piala dunia qatar bikin iri
253,fakta negara qatar tuan rumah piala dunia
258,faktafakta unik gelar piala dunia qatar
259,musuh teman final piala dunia
262,sunyi piala dunia qatar
265,sergio aguero resap aura argentina baharu juara piala dunia fifa qatar
266,inspirasi euforia piala dunia qatar ajang diadain nafa ningkatin sadar polusi udara indonesia nafas ajak publik lihat polusi udara kota
269,didier deschamps puas tampil olivier giroud laga final piala dunia qatar kemarin puas didier deschamps
273,live jam tonton bareng sorot tarik piala dunia qatar
274,menang argentina piala dunia qatar salah menang sejarah argentina pioneer depan messi dipercya kunci hasil team argentina
275,mbc sport rasa hebat bts jungkook qatar jungkook panggung upacara buka piala dunia hebat tarik idola lakilaki
276,update live jam tonton bareng sorot tarik piala dunia qatar ashoy media info baru jasa aged domain youtube
277,update live jam tonton bareng sorot tarik piala dunia qatar
279,piala dunia qatar sunatullah ubah
281,prediksi leeds united vs manchester city desember link claim bonus deposit deposit pulsa potong
282,ivana knoll sukses curi perhati dunia hadir piala dunia gelar olahraga gelar qatar pulang buat menang
283,tarik hasil final piala dunia qatar debat goat mbappe pecah rekor
284,lionel scaloni latih hasil bawa argentina juara world cup qatar minggu desember sejarah timnas argentina albiceleste juluk timnas argentina sukses angkat trofi piala dunia tiga kali sejarah
285,final piala dunia qatar argentina vs prancis ulang tuju kawan
286,info bola premier league brighton vs tottenham harry kane skuat raih point penuh tanding liga inggris brighton tottenham lanjut alhasil white
287,gol pakan gunting richarlison tentang serbia tempoh pilih gol baik johan piala dunia qatar bantah
288,ribu orang tanda tangan petisi final piala dunia ulang surabaya piala dunia argentina babat habis prancis adu penalti via
289,daftar main ganteng piala dunia qatar favorit pls tell me rodrigo deh paul argentina alisson brasil kevin trapp jerman bremer brasil olivier giroud prancis
291,golgol baik piala dunia fifa qatar
294,kalah arab saudi argentina hasil juara piala dunia qatar
295,qatar baik dunia ajar islam hilang pikir negatif tentang nicolas paul jaeger mantan ateis prancis masuk islam qatar helat piala dunia
296,kisah mantan atheis prancis nicolas jaeger masuk islam qatar tonton piala dunia
297,gol richarlison gol baik piala dunia qatar
298,menteri badan usaha milik negara bumn erick thohir kagum selenggara piala dunia erick nilai transformasi qatar hasil pesat
299,ivana knoll menang tinggal qatar piala dunia
300,vamos argentina juara piala dunia qatar
302,tonton piala dunia qatar impi nya pengin qatar aamiiiiin
303,ahli parlimen om tawar lionel messi as juta rm juta jubah pakai lepas argentina muncul juara piala dunia qatar kalah perancis
304,saing epl sambung isnin lepas bulan henti lalu temasya piala dunia qatar
307,kiper inter andre onana pensiun kamerun tengkar latih rigobert song piala dunia qatar
311,rezeki raup panggung piala dunia qatar bintang sepak bola harta dapat oleh hak kaum punya
313,argentina menang perancis piala dunia qatar
314,messi mbappe main psg turun piala dunia qatar
315,tanding akhir jeda piala dunia qatar ale cetak gol lima musim sama prestasi musim klub logo burung camar paut gol topskor brighton musim leandro trossard neal maupay
316,kbri doha gelar malam apresiasi sukarelawan indonesia libat selenggara piala dunia qatar
318,buntut aksi brutal piala dunia bintang uruguay ancam sanksi tanding
320,resmi gol baik piala dunia qatar jatuh bicycle kick gawang serbia brasil lumat serbia tanding buka grup
324,usaha restoran cabang manamana negara asal turki restoran uk as qatar tuan rumah piala dunia
326,senarai hadiah wang tunai piala dunia fifa qatar via
329,kbri doha gelar malam apresiasi volunteer indonesia libat fifa world cup kbri harga sanggarsanggar seni tokoh seni indonesia qatar aktif promosi indonesia piala dunia
330,pasca helat piala dunia qatar dunia negara eropa negara munafik harap
331,trailer kocak piala dunia qatar feat coach justin bocil senggo
332,prediksi indonesia matchday bri liga indonesia musim persikabo vs persib bandung
333,prediksi indonesia matchday bri liga indonesia musim dewa united vs baya surabaya
334,jadwal tanding sepakbola sabtu desember minggu desember wib
336,total hadiah serta amp juara piala dunia fifa panitia selenggara event qatar argentina juara piala dunia fifa stadion lusail iconic qatar argentina sukses kalah prancis final adu penalti seri normal kali menit
337,ft indonesia kamboja indonesia awal jalan piala aff menang kamboja
338,respect mbappe usia muda top skor hattick final piala dunia qatar
339,orang unjung piala dunia fifa qatar pilih peluk agama islam muallaf lengkap maklumat media youtube facebook youtube
340,bicara prestasi messi argentina juara piala dunia qatar sukses geser pegang rekor like ig
342,kes minum air banjir piala dunia qatar is the best world cup ever kupas minggu edisi
344,move on piala dunia fan berat argentina nama cucu muhammad messi surabaya hangat seru final piala dunia prancis via
349,skenario qatar messi menang piala dunia pertama argentina menang piala dunia kroasia menang piala dunia maroko amp afrika prancis juara piala dunia berturutturut
351,andai jejak kentut jam bosquh hubung wa link daftar ig
352,piala dunia qatar kompetisi sepakbola dunia gelar negara
353,prediksi mix parlay piala dunia league desember klik link
355,cosplayernya sumber video twittervkryp
356,elok siasat tindak salt bae ganggu trofi piala dunia tang argentina undang marah warganet
358,ya sedih tara ambek iran qatar serta piala dunia qatar serta lolos kualifikasi
359,oh prestasi baru sih serta piala dunia qatar
360,trailer kocak piala dunia qatar feat coach justin bocil senggo hahahahahahhaha
361,timnas argentina juara piala dunia qatar pesta henti langsung raya hasil argentina juara piala dunia tiga kali
362,piala dunia kabar baru tonton wanita telanjang dada ancam penjara qatar lifestyle
363,performa fan token sepak bola buruk piala dunia qatar
365,chef salt bae sok asyik fotofoto main timnas argentina pegang cium trofi piala dunia lapang stadion lusail qatar
366,piala dunia selesai argentina juara salah sita perhati wasit wanita piala dunia qatar
369,qatar selenggara piala dunia baik
370,video fifa ambil tindak salt bae cium trofi piala dunia qatar
374,piala dunia kerap panggung pentas main klubklub top eropa
375,postingan fifa piala dunia qatar bakar amarah fan setia crsitiano ronaldo
376,piala dunia qatar sudut pandang bola sepak
377,messi otw sabet ballon dor
378,ajar fatsoen politik piala dunia qatar
380,lionel messi main kenal argentina juara piala dunia qatar
382,best xi piala dunia qatar lansir tuju best xi versi komen main pilih bawah
383,kopi senja
384,capek banget habis lapangin dada luas lapang pildun kemarin
385,arsenal hilang gabriel jesus lutut alami qatar piala dunia
389,polis tumpas giat judi bola sepak piala dunia qatar tahan bookie punter serbu negara november kelmarin
390,lgbt sah sumbang sakit aids hiv juta orang seluruh dunia elok bang sokongansmp piala dunia ria konon sokong golong songsang tunasib qatar halang bentuk sokong lgbt piala dunia
391,salt baee daftar juru masak amp ahli gizi argentina world cup qatar resmi milik medali piala dunia hak raya squad argentina cerita media sok take a note guys
393,update ranking fifa pasca piala dunia argentina atas
395,juta chat whatsapp kirim final piala dunia qatar
396,jadwal tanding bri liga i indonesia jumat desember
397,gol jepang spanyol sah mari flashback yuk momentmoment piala dunia qatar kemarin
398,sambut erick thohir harap pikir perempuan buat lakilaki erick contoh perempuan hasil wasit piala dunia qatar
401,davies bantu kanada piala dunia kali tempoh jaring gol negara qatar pilih main baik bola sepak kanada
403,prediksi piala aff timnas indonesia vs kamboja desember link claim bonus deposit deposit pulsa potong
404,polis diraja malaysia pdrm jaya tahan individu syak libat taruh johan bola sepak piala dunia qatar
405,ramai kritik aksi chef salt bae pegang cium trofi piala dunia qatar fifa resmi umum buka lidi salt bae nama asli nusret gokce sorot ikutikutan raya menang
406,piala dunia qatar rampung bersiapsiap sambut piala dunia amerika utara tahu piala dunia amerika utara
408,serang baik piala dunia
409,bolavita mnc situs sbobet bank mnc wa
410,fifa buka suara perilaku salah undang final piala dunia timnas argentina lawan timnas prancis lusail iconic stadium qatar minggu malam wib desember
412,replika bisht pasang emir qatar messi piala dunia
413,polis diraja malaysia pdrm tumpas giat judi bola sepak piala dunia qatar tahan bookie punter terusi serbu negara november
414,piala dunia resmi negara tuan rumah piala dunia sports
415,polis tahan individu negara syak libat taruh johan bola sepak piala dunia qatar bukit aman polis buka kertas siasat kait taruh johan bola sepak piala dunia qatar bukit aman
416,polis buka kertas siasat kait taruh johan bola sepak piala dunia qatar polis tahan individu negara syak libat taruh johan bola sepak piala dunia qatar bukit aman
417,polis buka kertas siasat kait taruh johan bola sepak piala dunia qatar bukit aman polis tahan individu negara syak libat taruh johan bola sepak piala dunia qatar bukit aman
419,polis buka kertas siasat kait taruh johan bola sepak piala dunia qatar bukit aman
420,tahu kait migran piala dunia qatar darah amp keringat kerja migran tumbal bangun infrastruktur piala duniabayangkan piala dunia wajah migran final gelar des bareng kerja migran internasional
422,presiden fifa gianni infantino kepala sepak bola instagram desember kenang favorit piala dunia qatar jungkook alkubaisi benarbenar
425,real madrid timbang bek muda bakat ribu leipzig josko gvardiol kroasia bek usia tampil kesan timnas kroasia finis peringkat tiga piala dunia qatar
426,ambassador aice piala dunia fifa qatar messi juara dunia mbappe raih sepatu emas
427,ambassador aice piala dunia fifa qatar messi juara dunia mbappe raih sepatu emas simak
428,tim nasional timnas polandia pecat latih czeslaw michniewicz gelar piala dunia qatar czeslaw antar robert lewandoswki babak piala dunia henti prancis czeslaw michniewicz
430,orang piala dunia qatar salah ane kesan sih you target tonton deh anak istri wkwk
431,parade juara rakyat argentina piala dunia qatar via
432,ada main qatar main piala asia lu indonesia main piala dunia
433,eks striker italia emosi lihat laku salt bae final piala dunia bro
434,eddas postingan messi isi fotofoto juara piala dunia qatar likenya juta pantesan mecahin rekor likes instagram
435,argentina hasil menang piala dunia qatar main ligue tarik perhati berkat performa apik
