,tweet_bersih
1949,kalo pas tonton tv dengar cuplik theme song hayya hayya bumper logo piala dunia qatar terima kasih qatar selenggara piala dunia sukses
1950,laga final piala dunia qatar argentina vs prancis selesai main minggu desember link tonton gratis siar ulang final piala dunia qatar temu argentina vs prancis
1951,kuasa muda qatar pamer piala dunia sukses senang kenal islam
1952,lionel messi raih bola emas piala dunia qatar
1953,menang final piala dunia cryptocom bayang runtuh ftx redam pesta pora gemar
1954,menang final piala dunia bayang runtuh ftx redam pesta pora gemar
1956,hadiah argentina juara piala dunia qatar capai miliar
1959,hasil tanding piala dunia fulltime link argentina prancis extra time argentina prancis pengin
1960,riah final piala dunia fifa qatar fan argentina prancis adu semangat dukung tim pentas sepak bola akbar dunia yuk saksi riah
1961,argentina pimpin lionel messi kalah prancis adu penalti menang piala dunia fifa qatar main usia tahan gembira menang piala dunia fifa
1962,terima kasih baca artikel piala dunia qatar
1963,timnas argentina menang adu penalti prancis final piala dunia aas lengkap
1964,selamat argentina juara piala dunia qatar nanti juang legenda messi vamos vamos argentina
1965,argentina juara piala dunia tiga kali sejarah jaya kapten argentina menang harga golden ball main baik qatar
1966,momen messi bawa angkat trophy piala dunia raya rekan timnas argentina jawara piala dunia bravo timnas argentina
1967,argentina raih tropi juara tiga kali piala dunia qatar
1968,penuh tegang argentina hasil raih juara piala dunia qatar penuh tegang argentina hasil raih juara piala dunia qatar kabupaten bogor tanding sengit tegang final piala dunia qatar hasil
1970,penuh tegang argentina hasil raih juara piala dunia qatar
1971,kapolres metro tangerang kota laksana giat tonton bareng final piala dunia qatar ketua rw wilayah polsek jajar wartawan bagi doorprize tempat ruang aula polres metro tangerang kota minggu desember
1972,ganti main prancis babak catat sejarah argentina juara piala dunia qatar
1974,kalah penalti varane prancis juang
1975,rangkai foto main argentina lionel messi angkat trofi piala dunia rekanrekan tim upacara serah trofi piala dunia fifa stadion lusail lusail qatar desember
1976,argentina juara piala dunia qatar tonton seru laga malam rangkum infografik
1977,bhabin polsek cipondoh polres metro tangerang kota aiptu insan nurdin laku monitoring menontonbareng final piala dunia qatar prancis vs argentina jl kah ahmad dahlan rt petir cipondoh situasi aman kondusif minggu wib
1978,dapat berita tarik gemerlap bola dunia hari langsung qatar unjung download aplikasi appstore playstore
1981,argentina juara piala dunia kalah perancis babak adu penalti laga argentina vs perancis final piala dunia stadion lusail qatar minggu malam wib
1982,argentina mania suaranyaaa argentina juara final piala dunia qatar lawan prancis skor congrats argentina
1983,trans cipung prediksi argentina juara piala dunia qatar
1984,argentina hasil menang tanding final piala dunia qatar lusail iconic stadium minggu malam wib argentina bungkam prancis babak adu penalti main imbang babak panjang pertand
1985,piala dunia qatar hadiah uang juara bonus tim lolos kualifikasi tanding
1986,intip daftar koleksi tropi lionel messi menang piala dunia qatar
1987,malam polsek cipondoh polres metro tangerang kota laku aman menontonbareng piala dunia fifa qatar mcdonald jl kah hasyim ashari cipondoh situasi aman kondusif minggu wib
1988,karma is real mbappe sepak bola amerika selatan level eropa
1990,messi main baik dunia raih juara piala dunia qatar ronaldo main baik icon sepak bola dunia hebat karirnya pesepakbola bakat
1993,selamat argentina juara piala dunia sukses qatar kado indah lionel messi kali tampil piala dunia messi raih golden ball bola emas simbol harga main baik piala dunia
1994,viral selebrasi mesum emi martinez kecam netizen dunia final piala dunia qatar lawan prancis
1995,presiden turki recep tayyip erdogan terbang doha qatar minggu hadir upacara tutup piala dunia fifa
1996,messi main baik argentina final piala dunia
1997,congrats
1998,selamat tim nasional argentina juara piala dunia sepakbola qatar moga sukses sukses bersamasama qatar doha
1999,lets read drama adu pinalti gengsi bawa argentina juara piala dunia qatar by click this
2000,presiden turun gunung momen emmanuel macron hibur kylian mbappe final piala dunia via
2001,lionel messi nobat main baik piala dunia tunjuk golden ball harga golden ball messi sports
2002,messi mbappe gila menang sepak bola
2003,aparat aman turki polisi anti huru hara unit jinak bom tim operasi khususdikerahkan qatar aman turnamen piala dunia
2004,batal deh janganjangan pildun kelak sukses bawa argentina angkat trofi piala dunia lionel messi gagal pensiun tim nasional
2005,daftar main baik piala dunia qatar
2007,bkalan kangen banget piala dunia qatar cipta momen sejarah piala dunia kali maroko negara afrika hasil masuk semi final messi hasil sabet gelar goat mbappe hasil menang gelar usia muda respect
2008,tarik sepak bola enggaktau knapa piala dunia pengin tonton kejut duga pildun pildun qatar
2009,pensiun messi tegas bela argentina raih piala dunia
2010,bawa argentina juara piala dunia qatar messi jubah spesial liput
2011,latih timnas argentina lionel scaloni catat latih muda piala dunia qatar lahir rosario argentina mei scaloni usia ramu taktik tim tango piala dunia
2012,argentina juara piala dunia
2013,argentina sukses juara piala dunia qatar lionel messi tuhan beri firasat derita dapat
2016,cipung prediksi argentina juara piala dunia qatar
2017,selamat argentina juara piala dunia argentina trofi piala dunia tiga sejarah juara dunia kali
2018,argentina hoki nya qatar qatar tuan rumah piala dunia lu an pas argentina juara wayah tuan rumah argentina juara kayak qatar bagus banget argentina
2019,daftar hadiah juara piala dunia qatar tim kalah hadiah rinciannya
2020,statistik drama warna argentina juara piala dunia qatar
2021,menang adu penalti messi kawankawan juara piala dunia qatar
2022,jungkook gallup korea survei nyanyi amp lagu populer bts tempat posisi usia an dukung jungkook puji lagu tema resmi dreamers upacara buka piala dunia qatar
2024,kenal jubah hitam pakai lionel messi kado spesial emir qatar piala dunia
2025,tim nasional argentina juara piala dunia kalah prancis stadion lusail qatar senin desember wib
2026,argentina juara piala dunia qatarsetelah main imbang menit score team paksa main adu pinalti argentina hasil kalah prancis adu pinalti score
2027,gelar juara lionel messi piala dunia ego maradona bangga anak asuh gelar pensiun laga internasional admin lihat sang goat pensiun selamat argentina gelar juara piala dunia qatar
2029,piala dunia dukung timnas indoensia aff jadwal lengkap
2030,final piala dunia baik no debat ayo jujur tuan rumah qatar baik tuan rumah piala dunia no debat
2031,argentina juara piala dunia qatar libas prancis drama adu tendang penalti berita lengkap kunjung
2032,menang messi cs piala dunia qatar debat goat messi vs ronaldo goat inspirator sepakbola
2033,congratulations timnas argentina juara piala dunia edisi on qatar gelar timnas argentina griya babatan mukti
2034,radar bogor koleksi gelar messi klub negara piala dunia qatarradar
2035,lionel messi putus seragam timnas argentina
2036,congrats argentina vamos goat selamat argentina menang piala dunia qatar hasil kalah france adu pinalty
2038,adu pinalti skor argentina juara piala dunia tumpas prancis stadion lusail qatar minggu malam desember
2040,piala dunia qatar anggap remeh anggap seru awal iconic ukir sejarah
2041,kapolres metro tangerang kota kombes pol zain dwi damping wakapolres metro tangerang kota akbp bambang yudhantara salamunsik pju laksana giat tonton bareng final piala dunia qatar
2042,cerita berbeza qatar cristiano ronaldo dominasi bola sepak generasi iring messi
2044,selamat argentina juara piala dunia qatar trophy
2045,lionel messi main baik piala dunia qatar
2046,ratus ribu warga argentina turun jalan kota buenos aires raya menang timnas argentina laga final piala dunia qatar
2047,salah final dramatis sejarah modern piala dunia qatar argentina kalah prancis skor adu penalti juara piala dunia kali
2048,presiden prancis mbappe cetak hattrick final hebat
2049,argentina juara piala dunia qatar lionel messi piala idamidamkan gelar sudah debat baik cristiano ronaldo
2050,lionel messi bawa argentina rebut piala dunia kalah prancis adu penalti lusail stadium qatar minggu
2051,france national team bangga kalah hormat final piala dunia qatar
2052,megabintang argentina lionel messi hasil antar timnas negara juara piala dunia qatar
2053,argentina hadap prancis final piala dunia qatar lusail stadium al daayen qatar minggu wib
2054,seru rangka menontonbareng final piala dunia malam posko sutikno selamat argentina juara piala dunia qatar selamat menang doorprize moga manfaat
2055,hujung helat pesta sepakbola dunia qatar upacara tutup gelar riah nyanyi davido aisha daulat nyanyi lagu resmi piala dunia hayya hayya berita
2056,terima kasih saksi piala dunia qatar ictv
2058,gelar juara helat piala dunia qatar harga main timtim laga messi kylian mbappe bagi harga ajang berita
2059,prancis kalah final piala dunia qatar kylian mbappe menang tenang presiden prancis
2060,argentina hasil raih gelar piala dunia qatar gelar juara nanti lionel messi
2061,selamat argentina keren menang juara dunia piala dunia kali sejarah
2062,selamat argentina juara piala dunia
2063,adu mekanik serang psg final rio ferdinand indah
2064,argentina resmi sandang gelar menang piala dunia qatar kalah prancis adu penalti
2065,vamos argentina juara piala dunia qatar king leo messi sequat albiceleste
2066,eksklusif qatar atraksi pesawat tempur riah laga final piala dunia atraksi pesawat tempur sambut hadir fan saksi final piala dunia pesawat
2067,seru menontonbareng final piala dunia rutan surabaya sidoarjo piala dunia fifa helat qatar pasuk babak negara temu partai final rebut piala dunia kali
2070,emi martinez argentina juara piala dunia takdir
2071,sosok erika choperena istri serang prancis antoine griezmann curi atensi bangku tonton piala dunia qatar kenal jarang eks foto erika
2072,kelar world cup qatar terima kasih memori kejut piala dunia unik ada novemberdesember full drama kontroversi salah baik we will miss you
2073,congrats messi kau thailand terus turnamen piala dunia qatar world cup
2074,timnas argentina resmi juara piala dunia qatar takluk timnas prancis adu penalti skor main skir minggu malam wib
2075,enzo fernandez lionel messi emiliano martinez kylian mbappe harga piala dunia qatar
2076,mbappe raul los garagara komika
2077,piala dunia qatar lionel messi kylian mbappe ukir rekor ment
2078,argentina muncul juara piala dunia qatar lepas tunduk juara tahan perancis tentu pakan penalti stadium lusail doha sebentar
2080,argentina juara piala dunia fifa qatar
2081,terima harga lengkap piala dunia
2082,judul final piala dunia qatar mbappe manekin
2084,hasil argentina juara piala dunia qatar lengkap hasil borong harga individu hujung partai final
2085,senang saksi sejarah messi the greatest of all time bawa argentina juara piala dunia qatar selamat
2086,argentina messi piala dunia qatar
2087,lionel messi hasil lengkap karier antar argentina juara piala dunia toreh messi sah salah greatest of all time
2088,serang prancis kylian mbappe duduk lesu kalah adu penalti tanding final piala dunia qatar argentina vs prancis stadion lusail utara doha qatar minggu foto afp simak fotofoto
2089,juara piala dunia qatar
2090,kalah arab piala dunia qatar argentina tutup gelar world cup champion kalah perancis adu pinalti tahan seri tambah
2091,rodrigo deh paul timnas argentina juara
2092,saing sengit messi mbappe piala dunia qatar man of the match
2093,lionel messi toreh rekor spesial bantu argentina juara piala dunia qatar
2094,adu penalti argentina juara piala dunia qatar
2095,media monitoring top figur des messi jokowi mbappe anies baswedan ganjar pranowo luka modric erick thohir ferdy sambo didier deschamps sandiaga uno berita messi bawa argentina juara piala dunia qatar
2097,argentina juara piala dunia qatar harga fan token arg amblas
2099,argentina juara piala dunia fifa world cup dengar cerita malam ramai join malakat big screen riuh malakat mall malam malam terus hadir malakat mall minggu
2100,argentina kampiun piala dunia qatar via
2101,hasil juara tiga proyek ambisius akademi bola maroko bayar piala dunia qatar maroko hasil sejarah piala dunia tim afrika hasil tembus semi final loh blistener
2102,bangga banget vamos argentina negara pegang piala dunia finally ya messi libur bahagia prancis did great job mbappe congratulations argentina champions fifa world cup qatar
2103,messi main baik turnamen argentina panen harga mbappe top skor
2104,gaya deret seleb tonton langsung final piala dunia qatar
2105,angel maria argentina final piala dunia qatar
2107,piala dunia qatar selesai wayahe makaryo buka jam malam service garansi sparepart komplit
2108,sambut jaya argentina lepas tang piala dunia qatar buenoe aires argentina
2109,infografik menang anugerah piala dunia fifa qatar sahih berita rtm
2110,jokowi biar politisasi agama milu arab saudi dybala rungkad kalah pildun raul los maria
2111,helat piala dunia qatar selamat argentina
2112,score tanding argentina prancis adu pinalti argentina prancis argentina menang piala dunia qatar
2113,nanti panjangampnbsppele lionel messi juara piala dunia qatar
2114,foto main argentina gelar parade menang piala dunia qatar
2116,sepakbola selesai debat tamat lmessi menang cristiano ronaldo piala dunia mimpi selamat argentina juara world cup qatar
2117,momenmomen tarik messi cs juara piala dunia
2118,emiliano martinez bawa bendera argentina juara piala dunia qatar
2121,eksklusif qatar juara piala dunia fan timnas argentina menang bangga timnas argentina juara piala dunia kalah prancis drama adu penalti skor minggu
2122,prediksi menteri bumn argentina juara kalah prancis piala dunia qatar selamat argentina selamat messi layak juara dunia
2123,selamat negara argentina juara piala dunia qatar
2124,kalo pinjem duit fix fan prancis
2125,asyik menontonbareng final piala dunia magetan collaborative space tonton bareng menontonbareng final piala dunia qatar gelar magetan collaborative space mcs magetan via
2126,piala dunia qatar edisi format turnamen ikut negara piala dunia fifa putus tambah serta negara alas world cup qatar tanding legendaris
2127,alhamdulillah terima kasih perintah qatar fifa sukses piala dunia fifa qatar lancar salah kontroversi sejarah
2128,selamat messi argentina angkat trofi piala dunia
2131,kalah timnas prancis runnerup skor argentina tanding babak final piala dunia fifa lusail stadium lusail qatar minggu desember powered by
2135,soundtrack resmi piala dunia fifa qatar dreamers nyanyi jungkook grup bts capai hasil
2137,argentina juara final piala dunia qatar messi pecah rekor
2138,ajar final piala dunia partai puncak messi sah goat
2139,soundtrack resmi piala dunia fifa qatar dreamers nyanyi jungkook grup bts capai hasil im voting kali for audacys
2140,simak fakta tarik piala dunia qatar
2141,elon musk menontonbareng langsung final piala dunia qatar stadion heboh
2142,sejarah sd
2143,potret upacara tutup piala dunia seru banget
2144,match antiklimaks perancis performa amp hasil next pildun
2145,selamat timnas argentina sukses boyong piala dunia qatar
2146,informasi biodata leo messi lengkap tim inti argentina juara piala dunia qatar
2148,presiden prancis emmanuel macron selamat latih main argentina jelang beri trofi piala dunia qatar
2149,perancis main kemarin kemarin main hebathebat full pressure argentina super cepat main seru tonton dasar argentina menang piala dunia qatar
2151,lupa grup final drama hibur piala dunia qatar baik
2152,info bola argentina prancis lionel messi menang piala dunia kaki ngel mar a dominasi sportalavista maria main rindu
2153,rapor main argentina final piala dunia messi the real goat
2154,argentina juara piala dunia terima kasih teman parabola percaya isi paket voucher piala dunia qatar
2155,dahsyat piala dunia qatar cetak rekor gol
2156,jujur piala dunia tuh baik piala dunia qatar tarik faktor tahan piala dunia baik tonton
2158,piala dunia qatar argentina juara kalah prancis partai final istimewa main argentina main baik ajang ehmm
2160,info bola argentina prancis lionel messi menang piala dunia argentina dominasi jalan tanding kaki ngel mar a sportalavista maria main
2161,piala dunia argentina juara
2162,bombastis total trilliun rupiah hadiah juara fifa world cup piala dunia qatar capai uang rp miliar rincian lengkap
2163,piala dunia qatar momen messi peluk ibu lengkap klik taut
2164,satudesa slot bandar slot gacorrr min depo ribu link
2165,piala dunia qatar hibur presiden mbappe sedih lengkap klik taut
2166,selamat argentina resmi juara piala dunia qatar jagoin argentina semalem
2167,argentina juara piala dunia qatar messi main bola raih lengkap
2168,cak imin protes warganet ramai piala dunia qatar
2169,timnas bangga satusatunya tim ajang piala dunia qatar kalah juara
2170,cetak hattrick final piala dunia presiden prancis kylian mbappe hebat
2171,argentina juara piala dunia qatar kalah prancis drama adu penalty
2172,putus lawan penuh piala dunia qatar argentina perancis sahih berita rtm
2173,daftar harga individu piala dunia qatar
2174,kapten tim nasional argentina lionel messi gembira trofi piala dunia qatar
2175,jalan putra bulukumba panitia piala dunia qatar
2177,lionel messi resmi sandang gelar goat bantu argentina juara piala dunia qatar
2178,argentina pulang bawa piala menang duel adu penalti lawan perancis terima kasih jamu baik hutang pada
2180,erick thohir bagi kebersamaanya legenda sepakbola hadir final piala dunia qatar
2181,makna jubah bisht kain pasang lionel messi emir qatar angkat trofi piala dunia
2182,congrats argentina hasil tang gelar piala dunia edisi sekian puasa gelar edisi pildun selamat leo mimpi mu pensiun kado indah
2183,ribu dukung timnas raya menang tim tango juara piala dunia qatar lapang monumen obelisco kota buenos aires argentina minggu foto fotoreutersagustin marcarian lihat foto
2184,piala dunia qatar lionel scaloni butuh bawa argentina jaya lengkap klik taut
2185,juara piala dunia messi ulang selebrasi ikonik maradona pildun
2186,piala dunia qatar pisah manis messi timnas argentina lengkap klik taut
2187,terima kasih qatar bikin helat piala dunia serba
2188,piala dunia qatar argentina kuasa award piala dunia lengkap klik taut
2189,lionel messi angkat trofi garis jalan argentina piala dunia qatar
2190,piala dunia qatar lionel messi angkat trofi piala dunia lengkap klik taut
2191,menteri bumn puji qatar sukses selenggara piala dunia erick harap indonesia contoh negara tepi teluk sia maju ekonomi gerus budaya juooss bangkit erick thohir
2192,juara dunia seru messi mikrofon stadion gol tendang penalti bawa argentina raih gelar juara piala dunia qatar
2193,elon musk kejut hadir saksi tanding final piala dunia qatar duduk samping menantu donald trump
2194,resmi tamat sepak bola menang piala dunia qatar
2196,emir negara qatar penuh janji selenggara juara negaranegara arab sempat masyarakat dunia ajar kaya budaya asli nilainilai piala dunia messi
2197,benar argentina juara menang adu pinalti argentina prancis score tanding argentina prancis untunguntungan deh untung argentina argentina menang piala dunia qatar
2198,hasil tanding piala dunia qatar malam argentina juara piala dunia qatar
2199,menang piala dunia qatar argentina gelar tiga argentina piala dunia kali tang turnamen
2200,jadwal tayang ulang final piala dunia qatar senin desember indosiar argentina vs prancis
2201,argentina tang lawan piala dunia lepas tewas perancis terusi tentu pakan penalti putus stadium lusail doha qatar pagi
2202,selamat pagi selamat menang argentina piala dunia qatar
2203,dampak piala dunia qatar gula darah tensi selamat argentinasebagai juara qatar
2204,tanding adu pinalti menang tim argentina kukuh nama juara piala dunia qatar selamat ya tim tango argentina
2205,monitoring aman menontonbareng final piala dunia qatar wilayah hukum polsek bontang barat
2206,messi tim bawa argentina juara piala dunia fifa world cup qatar perancis
2207,piala dunia gue excited beli paket italia masuk messi gue habis fifa qatar tuan rumah masalah gamewise salah baik warbiyasak
2208,pildun ajang piala dunia baik menurutkuentah knptp beda adem banding sblumnya
2209,piala dunia legenda inggris david beckham piala dunia qatar tampil main kelas
2210,argentina juara piala dunia lionel messi goat jalan tim tango qatar
2212,emiliano martinez argentina juara piala dunia surat takdir
2213,maia estianty terbang qatar dukung prancis juara piala dunia
2214,lionel messi hasil bawa negara argentina juara piala dunia qatar prestasi dunia sepak bola main argentina milik koleksi mobilmobil mewah mahal simak koleksi mobil mahal mega bin
2215,piala dunia qatar piala dunia baik penuh kejut
2216,omedetou art messi twitterhaku
2217,terimakasih piala dunia qatar piala dunia indah tonton selamat sang goat lionel messi karirnya piala dunia indah selesai debat baik messi
2218,gagal bangkit king leo gapai impi bawa negara nya juara piala dunia qatar
2219,selamat argentina juara piala dunia qatar messi is goat
2221,rawan indonesia piala dunia qatar pikir bayar alam spesial
2227,yandex piala dunia mudah tonton world cup qatar
2229,leo messi is player of the match kembarbola besar amp percaya game lengkap menang bayar
2230,loser is loser
2231,selamat pagi terimakasih saksi menang argentina piala dunia qatar promo event tarik bikin player slot betah main web
2232,drama finalti argentina juara piala dunia qatar
2233,argentina menang dont cry for me argentina juara piala dunia qatar
2234,pele aku lionel messi layak raih juara piala dunia qatar
2235,selamat
2236,momenmomen tarik argentina vs prancis final piala dunia triple nutmeg maria messi kecup trofi pildun
2237,kylian mbappe sedih hebat hasil sepatu emas cetak gol turnamen piala dunia hebat main angkat trofi pildun kali
2238,hasil kalah jerman pildun final negara benua amerika eropa kayak piala dunia final negara benua eropa amp benua amerika tuan rumah negara asia qatar
2239,adu mekanik serang psg warna final piala dunia rio ferdinand indah
2240,messi juara piala dunia qatar juara hati
2241,harga piala dunia qatar main baik lionel messi main muda baik enzo fernandez kiper baik emiliano martinez top skor kylian mbappe gol
2242,golden boots world cup kylian mbapp goal
2243,the best world cup ever qatar kontroversi politik kejut amp drama anggap piala dunia gagal saji piala dunia baik kisah cerita terima kasih qatar
2244,main argentina raya hasil raih piala dunia qatar winner
2245,argentina amp perancis masuk putar final world cup qatar tanding stadion lusail iconic undang spekulasi masmen bumn amp harap dominasi piala dunia rata melulu eropa
2248,sabtu desember stadion khalifa internasional qatar tarung kroasia qatar skor gol kroasia amp gol maroko kroasia resmi juara iii piala dunia amp maroko posisi juara iv
2249,argentina borong harga serbaserbi piala dunia qatar bee news
2250,selamat pagi sahabat kompas menang argentina perancis final piala dunia qatar sorot gelar bawa messi puncak dunia abadi salah sepak bola baik sejarah
2251,timnas argentina juara piala dunia qatar dramatis seru tegang adu penalti mbappe mantap martinez messi istimewa
2252,final baik final piala dunia qatar cipta rekor tarik
2253,timnas argentina hasil kalah juara tahan prancis final piala dunia qatar drama kejarkejaran gol
2254,piala dunia qatar argentina
2256,fansclub ronaldo haaland juara dunia dybala emi martinez drake maria rungkad higuain deh paul maradona coman madrid deschamps lautaro giroud mac allister pildun kalah benzema main menang prancis wc arsenal all france arab saudi dodo copa america bola piala dunia
2257,piala dunia qatar messi borong rekor
2258,piala dunia qatar kali kes epic argentina king world cup tep idola bang ronaldo
2259,kemanangan argentina perancis gagal tahan gelar juara piala dunia qatar kylian mbappe ukir tinta emas main tajam piala dunia qatar
2260,congrats argentina juara piala dunia qatar kapten lionel messi bawa argentina menang prancis laga puncak final piala dunia stadion lusail qatar senin wib
2261,prediksi erick thohir timnas sepakbola argentina hasil juara piala dunia kalah prancis partai final lusail iconic stadium qatar adu penalti argentina hasil tekuk prancis skor
2263,juara nya argentina piala dunia qatar sih you soon piala dunia moga timnas indonesia lolos playoffwalaupun mustahil
2264,pakai abaya qatar angkat trofi messi syekh nih
2265,argentina sabet piala dunia rodrigo deh paul juara
2267,piala dunia qatar selamat argentina lusail stadium
2268,argentina juara piala dunia qatar kalah timnas prancis drama adu penalti lusail iconic stadium minggu wib faz
2269,piala dunia qatar argentina champion winner argentina hasil juara dunia tumbang perancis adu penalti tanding babak final piala dunia
2270,final piala dunia baik gelar
2271,drama adu pinalti final piala dunia qatar menang argentina
2272,fantastis gin bayar kylian mbappe piala dunia qatar main mahal lombok insider
2274,profil biodata kylian mbappe timnas prancis cetak gol piala dunia qatar lombok insider
2275,icymi gelar piala dunia qatar gelar piala asia timnas indonesia rasa atmosfer stadium piala dunia
2276,main argentina raih harga piala dunia qatar lionel messi main baik enzo fernandez main muda baik emmiliano martinez kiper baik messi the greatest of all time
2277,mbappe cemerlang babak final sayang juara
2278,total messi kali pilih man of the match piala dunia qatar vs mexico vs australia vs belanda vs kroasia vs prancis messi the greatest of all time
2279,speechless sih final seru semalem selamat argentina bawa pulang trofi piala dunia selamat mbappe gacor sih lu top soccer kayak the next goat deh lu calon pildun depan
2280,final piala dunia bikin degdegan banget
2281,qatar piala dunia penuh kontroversi tampil main prestasi
