,tweet_bersih
1592,dybala selebrasi gunting jaring gawang menang argentina atur
1593,hasil piala dunia
1594,argentina juara piala dunia qatar gin lho hadiah
1595,lampau lionel messi mbappe pasang muka muram piala dunia qatar
1598,thankyou qatar prancis all argentina messi batal pensiun menang piala dunia
1601,daftar artis tonton langsung final piala dunia qatar maia estianty najwa shihab
1602,maia estianty irwan mussry qatar tonton final piala dunia
1603,foto hoaks pek burung hantu warna biru jimat timnas maroko laga piala dunia qatar
1605,lionel messi bawa argentina juara piala dunia status greatest of all time resmi sandang harap debat
1606,kado spesial emir qatar jubah bisht lionel messi piala dunia tuai kecam
1607,luarbiase qatar jurus qatar sukses kenal budaya islam piala dunia
1608,prancis backtoback juara emi martinez
1609,cundang arab saudi argentina juara
1610,deret foto hoaks pek burung hantu warna biru jimat timnas maroko laga piala dunia qatar
1611,mbappe amerika selatan level eropa kalah
1612,kylian mbappe top skor piala dunia
1614,lionel scaloni latih muda juara piala dunia
1615,main prancis raphael varane hugo lloris negara tinggal qatar kepala tegak juang piala dunia
1616,selamat fan argentina messi fan france semangat ya mbappe karier world cup qatar piala dunia baik tonton publik tuju selamat senin guys
1617,argentina kali juara piala dunia juara argentina juara mexico amp juara tiga qatar mario kempes gol ego maradona gol lionel messi gol
1618,piala dunia fifa qatar capai jaya segenap aspek anjur piala
1623,prediksi sydney selasa desember bom angka langsung jemput wa gratis
1624,personel polres ternate malu utara malut terjun lokasi ramai aman konvoi dukung tim nasional argentina laga final piala dunia qatar senin
1625,cetak gol piala dunia qatar kylian mbappe sabet sepatu emas
1626,detikers tahu batu mulia warna hijau malaikit hias trofi piala dunia qatar sampel kota bandung simak yuk via
1628,prancis runner up piala dunia qatar selamat semangat pantang serah
1629,lionel messi argentina piala dunia qatar lengkap
1630,argentina hasil sandang gelar juara piala dunia qatar menang milik messi tim dampak ekonomi negara tim tango lengkap
1631,jubah bisht messi piala dunia tuai kecam
1633,giring berita tonton argentina menang messi kado karir fifa eh pas france mbappe menang ubah opini nya halah tahi ketawa deh piala dunia qatar baik bro kuh
1634,update penuh bohong deret hoaks putar piala dunia qatar
1635,update penuh bohong deret hoaks putar piala dunia qatar ashoy media info baru jasa aged domain youtube
1637,rekor cipta piala dunia qatar
1638,detikers tahu batu mulia warna hijau malaikit hias trofi piala dunia qatar sampel kota bandung simak yuk
1639,messi pahlawan piala dunia qatar tebar wallpaper hp messi the goat internet
1640,argentina juara ajar politik kompetensi piala dunia piala dunia qatar ajar politik kompetensi kompetisi pilpres senang lahir pimpin kompeten
1641,viva albiceleste menang piala dunia kali argentina mexico qatar top scorer mario kempes gol top scorer maradona gol top scorer lionel messi gol terimakasih nya kak god bless
1644,agam momen tarik warna langsung piala dunia qatar lapang lapang
1645,dukung argentina artis tonton final piala dunia qatar
1646,libas prancis final piala dunia qatar argentina ganjar rp miliar
1647,argentina tang lawan piala dunia lepas tewas perancis terusi tentu pakan penalti putus stadium lusail doha qatar pagi getar baca
1649,batu mulia warna hijau malaikit hias trofi piala dunia qatar sampel kota bandung
1650,argentina menang piala dunia prediksi jose miguel polanco piala dunia qatar world cup messi
1652,lionel messi full senyum argentina hasil menang piala dunia qatar
1653,momen duga beikut fakta unik piala dunia qatar
1654,argentina juara piala dunia qatar taruh argentina rapper drake hilang juta us dolar tara rp miliar
1656,elon musk saksi langsung laga final piala dunia argentina vs prancis stadion lusail qatar minggu malam musk aku kagum laga
1657,neymar masuk pusar saing lionel messi kylian mbappe final piala dunia qatar
1658,hattrick toreh mbappe laga final tambah koleksi gol delapan piala dunia fifa qatar
1659,terimakasih qatar tuan rumah piala dunia
1661,cuil cuplik closing ceremony piala dunia lighting baik sound baik thanks qatar tuan rumah piala dunia baik
1662,ikut ah kali argentina juara piala dunia fana argentina top skor mario kempes meksiko top skor ego armando maradona qatar top skor lionel messi
1664,kenal jubah istimewa piala dunia qatar pakai khusus lionel messi
1665,piala dunia qatar rampung
1666,lagu osnya kerenjuara piala dunia benarbenar ramah tuan rumah qatarpiala dunia amanpertandingan habishabisan lebih kurang
1667,selamat menang argentina piala dunia qatar
1668,kali juara piala dunia juara argentina mexico qatar mario kempes gol ego maradona gol lionel messi gol
1669,piala dunia qatar klaim baik arie untung rangkum drama
1670,argentina juara piala dunia qatar karir messi
1671,prancis gagal juara piala dunia takluk argentina qatar presiden prancis peluk hibur mbappe sedih laga final momen foto photo
1675,jurus qatar hasil kenal islam piala dunia
1676,thanks qatar kali saji piala dunia novemberdesember malam piala dunia piala dunia impi inggris belanda angkat trophy
1677,argentina jawara piala dunia selenggara qatar hasil tumbang prancis drama adu pinalti skor laga argentina vs prancis final piala dunia qatar baca selengkapnyagtgt
1679,argentina juara piala dunia tanggal minggu qatar francis croatia maroko
1680,final piala dunia qatar saksi legenda bola juang masa karir sembari bentuk calon legenda
1682,sejarah catat piala dunia qatar kali lahir bintang sepak bola selamat fan messi sedih fan ronaldo selamat mbappe
1683,argentina juara piala dunia qatar lionel messi raya menang ala maradona
1684,untung saksi dua argentina juara dunia qatar saing selesai debat baik jawab angkat piala dunia sepakbola tamat next legend sepabola
1686,piala dunia qatar tarik piala dunia sebelumbelum nya liga kompetisi liga inggris champion
1687,merakamkan terima kasih tonton rana jaya kekal setia rtm siar berlesen piala dunia fifa qatar difahamkan rtmklik jaya tarik tonton lebih juta orang
1688,argentina hasil juara piala dunia kalah perancis babak adu penalti duel argentina vs perancis final piala dunia stadion lusail qatar minggu malam wib kalo kadrun dukung maroko iman wkwwkw
1689,warnantt sport argentina hasil raih trofi piala dunia kalah prancis final piala dunia stadion lusail qatar minggu malam wib read more at
1692,deret artis tonton langsung piala dunia qatar via vallen chevra
1693,foto selebrasi timnas argentina juara piala dunia lionel messi motm
1694,brasil juara pildun episode pildun tim eropa tang juara episode trophy pildun terbang tim amerika latin messi amp argentina nya
1695,lionel messi hasil bawa timnas argentina tim baik piala dunia qatar imigrasi bima lionel messi imigrasi bima layan kerja baik
1697,rentet rekor lionel messi bawa argentina juara piala dunia qatar
1698,rakyat argentina menang timnas sepak bola piala dunia qatar rasa padan obat sulit ekonomi dera bertahuntahun
1699,lionel messi catat ragam rekor bawa argentina juara piala dunia qatar messi sabet gelar main baik ajang
1700,sesuai harap main persib prediksi jago argentina juara piala dunia qatar
1701,juluk sultan deret artis tonton langsung piala dunia qatar
1703,selamat tim nasional sepakbola argentina juara piala dunia fifa qatar argentina perancis adu penalti treeletrik indonesia informasi hubung
1706,fan argentina kumpul tugu obelisk raya menang piala dunia qatar lawan prancis buenos aires argentina minggu
1707,messi argentina juara piala dunia nama ronaldo trending media sosial
1710,sosok antonella roccuzzo curi atensi argentina tanding piala dunia qatar sosok antonella istri lionel messi sang the goat
1711,piala dunia hasil kejut kayak maroko masuk semifinal kalah tim kayak spanyol portugal amp belgia kroasia tembus semifinal main tua nya sisi matchnya world cup qatar baik belum nya
1712,kalah prancis argentina juara piala dunia qatar
1713,karir kylian mbappe
1714,mario kempes messi deret legenda lahir rosario argentina
1715,keluar sydney desember result shio naga prediksi china senin desember ai best shio tikus bbfs
1718,rapper drake gigit jari pasal kalah taruh final piala dunia qatar drake bayar usd juta tara rp miliar
1719,lionel messi tiru gaya maradona raya juara piala dunia mimpi bayar lunas qatar
1720,menang gelar piala dunia qatar lionel messi pensiun dunia sepak bola
1723,emir qatar sukses piala dunia bangga dunia arab umat muslim indonesia bangga
1724,piala dunia makna jubah hitam messi pakai emir qatar angkat trofi
1725,pimpin emi martinez ruang ganti argentina mute of silence kylian mbappe
1726,piala dunia qatar federasi sepak bola dunia fifa alokasi hadiah total juta dollar as rupiah tara rp triliun kurs rp
1727,argentina juara piala dunia tim tango qatar malu arab saudi tanding laga juara kisah simak
1728,lionel messi toreh rekor bawa argentina juara piala dunia lengkap
1729,qatar beres pesta piala dunia akhirat besar aff cup piala cik gengsi tea haha
1730,prediksi menteri dagang zulkifli hasan argentina juara piala dunia qatar
1731,argentina sang juara piala dunia qatar juara kylian mbappe sukses sabet sepatu emas lionel messi raih golden ball main baik enzo fernandez raih main muda terbaikemiliano martinez raih kiper balik juara
1733,gelar juara piala dunia mulus menang lionel messi dkk bawa argentina posisi fifa world cup qatar potret messi dkk selebrasi menang pildun
1734,argentina hasil juara piala dunia qatar menang adu penalti hadap prancis
1735,potret najwa shihab tonton final piala dunia langsung qatar
1736,piala dunia qatar budaya islam
1737,impi argentina julang piala dunia kali tiga capai lepas jaya kalah perancis lawan piala dunia qatar malam
1738,final piala dunia argentina vs prancis sita perhati elon musk tonton langsung stadion lusail qatar minggu malam
1741,edisi argentina juara piala dunia qatar emaknya messi bangga anak juara mbappe sedih
1745,katakata magis peter drury antar argentina juara piala dunia
1746,argentina kampiun piala dunia sumber
1747,kabar buruk ancam masyarakat argentina lionel messi rekanrekannya tim nasional sah raih gelar juara piala dunia qatar
1749,selamat argentina juara piala dunia qatar messi main baik turnamen akbar kali kado indah pensiun timnas
1750,fyi qatar menang bidding selenggara turnamen piala dunia tanggal desember pas tweet ya tanggal final piala dunia selenggara
1751,ansarsoerya tonton bareng argentina juara piala dunia qatar masyarakat batam coid
1752,piala dunia qatar argentina juara suporter piala dunia qatar gambar ideal gelar no miras toilet bersih musola
1753,sikat prancis bawa argentina juara messi hasil
1754,argentina juara dunia piala dunia qatar marc marquez pasang foto lionel messi
1755,keluar cambodia desember result shio kerbau prediksi sydney senin desember ai best shio kelinci bbfs
1756,raul los sih kembar kylian mbappe dukung tim piala dunia qatar
1758,the real final adu kualitas lini drama balas balas gol main intensitas hasil rekor sejarah piala dunia amp malam bukti tim layak final qatar
1759,dunia sepakbola gempar menang argentina piala dunia qatar takluk perancis skor hingar bingar raya lari arah sang bintang lapang lionel messi ibu
1760,profil kylian mbappe main kunci timnas prancis final piala dunia qatar
1761,bulan gelar piala dunia qatar haturnuhun siar tonton sepakbola tarik tarik junjung fairplay kompetisi menang kalah hibur selamat argentina
1762,juara piala dunia qatar tanding panas final argentina lawan prancis lewat babak pinalti menang argentina score babak pinalti ayo dukung tim sayang mu bandarbola amp raih sempat hadiah nya
1763,hadiah juara piala dunia qatar
1764,main mahal laga prancis vs argentina partai final piala dunia qatar
1765,daftar lengkap juara piala dunia argentina menang
1766,negara qatar kenal piala dunia sejarah sepakbola dunia
1767,potret miss universe argentina tonton piala dunia qatar
1768,timnas argentina hasil juara piala dunia qatar mega bintang lionel messi pecah rekor albiceleste
1769,selamat tinggal fifa world cup qatar saji salah event piala dunia baik era modern kontroversi aku piala dunia kali beda final salah baik edisi
1770,hebat mbappe cetak gol piala dunia qatar liput
1771,prancis gagal juara piala dunia takluk argentina qatar presiden prancis peluk hibur mbappe sedih laga final potret
1772,sayang perancis kalah adu penalti argentina tanding final piala dunia qatar kalah perancis sebab investigasi sherlock holmes
1773,messi argentina panen rekor juara piala dunia
1774,congratulations juara piala dunia qatar vidionya keren
1775,didier deschamps kan sebab kalah prancis argentina final piala dunia qatar minggu desember
1776,selamat argentina messi menang piala dunia qatar lengkap koleksi piala mu greatest of all time
1777,cair daftar negara terima hadiah uang piala dunia qatar
1778,sergio kun aguero rombong timnas argentina qatar tani leo messi kamar selebrasi raya gelar piala dunia sindir edouardo camavinga sindir john terry sindir publik tanggap
1779,selamat ya mas messi tim argentina tang piala dunia qatar
1780,laga penuh drama argentina juara piala dunia qatar via com
1781,piala dunia stadion monumental buenos airesargentina argentina belanda tsmario kempes piala dunia stadion aztecameksiko argentina jerman barat tsmaradona piala dunia stadion losailqatar argentina perancis pinalti tsleo messi
1782,kali main baik piala dunia lionel messi
1783,pildun fc gila menit gila lelah final piala dunia salah final baik argentina juara lionel messi bahagia simak bahas pildun fc kali bareng
1784,kali gue tonton final piala dunia gila libur sekolah bal tonton ramean bus juara italiayup gue fan sepak bola italia final dramatis gue rasa gila final pildun semalem
1785,piala dunia jerman italia piala dunia afrika selatan spanyol piala dunia brasil jerman piala dunia rusia perancis piala dunia qatar argentina
1786,argentina kali juara piala dunia argentina top scorer mario kempes meksiko top scorer maradona qatar top scorer lionel messi
1787,kalah prancis final piala dunia qatar karma terima mbappe
1788,timnas argentina juara piala dunia qatar makna matahari senyum bendera argentina
1789,piala dunia qatar catat rekor gol
1791,england harga tim fair play piala dunia qatar
1792,kapten prancis anggap final piala dunia laga tinju
1795,serba serbi piala dunia qatar
1796,bayangbayang ego maradona piala dunia sempurna karier spektakuler lionel messi kunjung
1797,baik argentina juara copa america messi cs raih gelar juara piala dunia qatar
1798,negara muslim gelar piala dunia intip fakta tarik qatar bikin gelenggeleng
1799,momen mbappe peluk presiden gagal juara piala dunia qatar liput
1800,timnas prancis hasil cetak gol gawang lawan piala dunia qatar
1801,profil antonella roccuzzo sorot messi hasil bawa argentina juara piala dunia qatar
1802,fulltime argentina hasil menang piala dunia qatar nih
1803,argentina piala dunia qatar negara juara fifa world cup adu penalti
1804,dreamers by nyanyi tutup piala dunia qatar malam
1805,sukses piala dunia qatar
1806,messi catat rekor bawa timnas argentina juara piala dunia qatar minggu desember
1807,messi panen rekor juara alien goat paten no debat
1808,piala dunia qatar mana argentina hasil juara musim takluk prancis minggu desember
1809,argentina negara hadiah pinalti piala dunia qatar untung saat final malam tim kalah pinalti kali argentina kali coba bayang argentina pinalti
1810,pandang unik raya menang argentina piala dunia angkat trofi megabintang albiceleste lionel messi pakai jubah khas arab emir qatar
1811,rekor piala dunia qatar baca lengkap
1812,argentina juara piala dunia qatar gelar tiga tim juluk albicelestes
1813,link tonton siar ulang argentina vs prancis final piala dunia qatar klik link resmi
1814,lionel messi sesal kalah final piala dunia qatar hadap prancis minggu desember
1815,daftar lengkap hadiah uang tunai piala dunia qatar argentina banjir kucur bonus
1816,argentina juara piala dunia qatar hadiah uang terima laku
1819,simak berita lupa follow media sosial berita informasi
1820,hasil argentina vs prancis adu penalti messi tim hasil juara piala dunia qatar
1821,no debat selenggara piala dunia qatar baik sejarah tanding final baik sejarah selamat qatar amp argentina
1824,piala dunia qatar temu juara tiga kroasia hasil rebut gelar juara laga lawan maroko sabtu
1825,aksi mbappe kalah pukau cetak gol final piala dunia qatar
1826,lionel scaloni argentina vs prancis tanding gila
1827,fifa netizen final piala dunia qatar baik
1828,menang messinalti jalur penalti piala dunia qatar
1829,piala dunia nanti final tegang kunjung
1830,fantastis juta suporter tonton langsung laga piala dunia qatar posisi tiga sejarah
1831,wc qatar gue jagoin argentina juara piala dunia hasil tweet from this this
1832,dapat final piala dunia qatar argentina vs perancis partai final piala punia janggal
1833,argentina kalah france piala dunia stadion lusail qatar adu pinalti
1834,sukses gelar piala dunia rahasia maju qatar
1835,emir qatar pamer piala dunia sukses senang kenal islam
1837,argentina kalah prancis final piala dunia adu penalti skor menang tanding argentina parade lusail boulevard qatar
1838,menang piala dunia lionel messi tim gelar parade qatar
1839,argentina juara piala dunia qatar imbas manis anakanak argentina atlet sepakbola
1841,legenda inggris piala dunia tampil level main top
1843,lionel messi jubah spesial piala dunia makna momen tarik sheikh tamim bin hamad al thani pimpin qatar lionel messi mana sang
1844,latih argentina lionel scaloni kuasa tahan tangis bangga antar negara juara piala dunia qatar menang dramatis adu penalti raut tegang tanding akan lepas
1845,trofi piala dunia dybala bawa pulang oleholeh unik qatar
1846,cnth argentina ekonomi krisis menang pildun simpul gagas politik gagas ekonomi federasi fokus sepakbola inti niat mang bijak benah sepak bola nasional niat jalan roma
1847,stadion piala dunia qatar megah tawan
1848,seru menontonbareng final piala dunia qatar jajar kanwil kemenkumham sulteng budi argap situngkir
1849,momen messi angkat trophy argentina hasil menang piala dunia qatar skor
1851,juta warga argentina turun jalan antero kota dengar negara juara piala dunia qatar
1852,argentina hasil menang piala dunia qatar lewat drama lawan perancis skor menang adu penalti
1853,piala dunia qatar resmi argentina menang kalah prancis skor adu penalti stadion lusail minggu partai final saksi langsung ribu tonton
1854,kota argentina hias laut manusia negara juara piala dunia qatar
1855,argentina juara piala dunia kalah prancis adu penalti stadion lusail qatar minggu tim tango hasil sudah puasa gelar piala dunia tiga sejarah
1856,fantastis gin hadiah argentina juara piala dunia qatar
1857,laga final piala dunia argentina vs prancis lanjut babak tambah tim main imbang normal stadion lusail doha qatar minggu malam
1858,congratulations argentina for the winning word cup
1859,timnas argentina sukses juara piala dunia kalah timnas prancis adu penalti lusail iconic stadium qatar minggu desember iring menang argentina timnas arab saudi sorot
1860,selamat timnas hasil gelar juara piala dunia congratulation
1861,messi cetak gol argentina piala dunia qatar bawa juara fifa world cup
1863,selamat messi tamat piala dunia qatar
1868,raya menang argentina juara piala dunia fifa deret harga main tim performa baik ajang prestisius
1869,pimpin om wasit piala dunia qatar wajib tahan periode pimpin adil lapang
1870,selamat argentina argentina juara piala dunia qatar kalah prancis adu penalti
1871,messi toreh deret rekor final piala dunia qatar
1872,the best world cup ever qatar kontroversi drama cerita saji piala dunia baik congrats for argentina sih you soon world cup mexico canada source
1873,legenda mu southgate latih inggris putus
1874,zaman surabaya prestasi argentina baik empat final jokowi nyapres amp presiden runner up piala dunia brazil jokowi presiden argentina mmpu juara piala dunia qatar mana rengkuh silam
1875,video tangis messi peluk juara piala dunia qatar
1876,video bawa argentina juara piala dunia qatar messi jubah spesial
1877,argentina bantai arab saudi juara piala dunia qatar
1878,qatar resmi salah piala dunia baik tonton momen kesan piala dunia momen indah pranowo presiden republik indonesia
1879,nilai gagal bawa inggris lewat empat final piala dunia qatar gareth southgate percaya latih three lions
1880,qatar piala dunia baik dengar episode
1881,argentina juara piala dunia sepakbola qatar
1882,prancis aku unggul argentina final piala dunia qatar lusail stadium minggu desember
1883,helat piala dunia angkat posisi qatar salah negara mua arab dunia iring kembang ekonomi negara peluang kerja indonesia buka
1884,kado spesial sheikh tamim lionel messi piala dunia qatar warna emas
1885,dramatis tangis lionel messi bawa argentina juara piala dunia qatar
1886,video baru nawacita tv antusias warga argentina raih menang piala dunia qatar
1887,piala dunia qatar piala aff ayo bobrok iso juara yooohh moaaas
1888,bekas player jdt tolong jurulatih argentina bantu argentina juara piala dunia qatar
1889,nama salah main prancis harga sepatu emas piala dunia qatar kylian adesanmi mbappe dadak trending topik twitter
1890,argentina sukses raih trofi juara piala dunia lapang suporter dukung ritual pakai celanadalam balik tolak qatar
1891,kylian mbappe cetak gol piala dunia fifa world cup qatar striker prancis mbappe hasil harga sepatu emas piala dunia mbappe catat cetak total gol messi sumber fifa
1892,jalanjalan argentina penuh laut manusia timnasnya juara piala dunia qatar
1893,piala dunia qatar resmi usai pesta bola qatar edisi perdana jazirah arab drama kritik latar isu sosial budaya politik ekonomi hukum reda
1894,raih juara piala dunia qatar timnas argentina dapat trofi untun
1895,argentina hasil raih gelar piala dunia tiga kali messi dkk hasil tumbang prancis skor adu penalti main imbang menit final piala dunia qatar stadion lusail qatar
1896,main prancis kylian mbappe foto trofi golden boot milik kiper argentina emiliano martinez foto trofi golden glove upacara serah trofi piala dunia fifa stadion lusail lusail qatar minggu
1897,hugo lloris bahas depan kalah final
1899,laku selebrasi senonoh emiliano martinez tuai kecam
1900,girang argentina juara piala dunia tonton wanita qatar nekat tampil busana
1901,pesan menang tim sepakbola saudi arabia argentina ajang piala dunia qatar tulis buku journey the light uttiek panji astuti ulas
1902,merinding lagu chants sembah rajawi supporter maroko palestina totalitas maroko suporter dukung palestina piala dunia qatar link
1903,ig story david beckham final piala dunia hibur banget jalanjalan pakai masker qatar amp nali orang ngefanboy mbapp amp messi
1904,timnas argentina juara piala dunia qatar katakata lionel messi laga final
1905,kuda tua rasa qatar medan piala dunia lionel messi cristiano ronaldo neymar luka modric robert lewandowski luis suarez thomas mueller eden hazard gareth bale karim benzema
1906,ekonomi sepakbola selamat argentina lionel messi juara piala dunia qatar utas
1909,erick thohir sempat temu emir of qatar tamim bin hamad al thani qatar baik tuan rumah piala dunia
1910,piala dunia terima kasih qatar jumpa amerika
1911,sohor indonesia saksi langsung final piala dunia qatar
1912,congratulations kawankawan nya main bola nya hasil bawa negara juara piala dunia
1913,prediksi cambodia senin desember ai best shio kelinci bbfs
1915,piala dunia qatar piala dunia baik
1916,psg naik gaji lionel messi betah via
1917,muncul aktres kenal bollywood deepika padukone lawan piala dunia qatar jaya raih perhati ramai
1918,kalah messi sepatu emas piala dunia qatar jatuh tangan kylian mbappe laga final piala dunia argentina vs prancis mbappe hasil cetak hattrik berita lengkap kunjung
1919,bos prancis puas putus wasit laga final piala dunia
1921,piala dunia qatar emiliano martinez kiper urak andal argentina lengkap klik taut
1922,event piala dunia uang semester raib sidang sarjana tunda piala dunia tiket pesawat qatar
1923,emir qatar sukses piala dunia bangga dunia arab
1924,macallister uangkap rahasia argentina juara piala dunia
1925,bagus piala dunia qatar tamat tahniah syabas pasu arab saudi rana jaya pasu kuat fokus tengok afro conquer asia tenggara
1926,tangis messi peluk juara piala dunia qatar liput
1927,rakyat argentina kumpul jantung buenos aires pesta raya timnas argentina hasil juara piala dunia qatar
1928,tag teman pagi muka tekuk anyway congrats argentina menang
1930,waris karangtaruna garda aroengbinang perintah desa waris gelar tonton bareng final piala dunia qatar balaidesa waris camat kutowinangun minggu sumber
1932,update hadiah juara piala dunia qatar
1933,update hadiah juara piala dunia qatar ashoy media info baru jasa aged domain youtube
1934,jurus qatar sukses kenal islam piala dunia
1935,seru mah fc tonton bareng final piala dunia qatar aula upt rsud mas amsyar kasongan drama jual beli serang gol kali menit babak tambah argentina akhrinya menang perancis adu penalti skor
1936,argentina menang piala dunia qatar
1937,antonela roccuzzo istri lionel messi dukung sang suami tanding piala dunia qatar antonella gembira raya menang argentina
1939,piala dunia qatar kenang masyarakat dunia penuh kejut sejarah penuh drama
1940,argentina resmi juara piala dunia qatar lionel messi sah goat paripurna
1941,kapten timnas argentina lionel messi main baik ajang piala dunia qatar main paris saintgermain hasil bawa argentina juara piala dunia qatar kalah perancis
1942,final piala dunia qatar argentina vs perancis
1944,hahahaha mantap pssi selenggara piala dunia qatar
1945,hasil final piala dunia fifa qatar argentina juara kroasia tiga
1946,piala dunia qatar takhta titik bumi
1947,nasib didier deschamps prancis kalah final piala dunia
1948,qatar argentina pimpin sang kapten lionel messi angkat trofi piala dunia kandas lawan perancis adu penalti stadion lusail qatar senin wib
