,tweet_bersih
832,rt pdrmsia video pilih polis johor tumpas bookie judi piala dunia qatar tonton terusi paut sumber berita hari
833,cetak gol tua piala dunia pepe
834,sgtoto cair mimpi sama selamat menang hasil jersey adidas original sgtoto
836,menteri bumn indonesia mencotoh qatar sukses selenggara piala dunia indonesia tuan rumah piala dunia lu ajar qatar word cup lu jalan sukses
837,piala dunia bangga
838,maroko mimpi piala dunia
840,enak banget ya indonesia
841,piala dunia resmi tanda argentina juara sahabat pedooli qatar tuan rumah piala dunia sukses tonton hidup muslim ideal qatar supporter main tonton
842,menang argentina publik penasaran kisah cinta lionel messi istri antonela dukung piala dunia qatar
843,winslot win selamat menang hasil jersey adidas original winslot
845,piala dunia qatar resmi turnamen pilih nama masuk daftar starting xi buruk tuju
846,video pilih polis johor tumpas bookie judi piala dunia qatar tonton terusi paut sumber berita hari
849,final piala dunia warga bangladesh gelar ritual argentina juara
851,lihat statistik ragu messi goat sejati
852,laga final piala dunia qatar lionel messi kena pasang golden boots sandal detail sentuh
854,kylian mbappe emas delapan gol timnas prancis piala dunia qatar lengkap
855,catat rizal effendi lengkap tutup liput piala dunia qatar cerita wanita bilang semarak piala dunia hasil tuan rumah hebat bintang lapang cantik
856,raja salman pangeran mbs arab saudi selamat emir qatar hasil piala dunia
859,timnas argentina kuat lionel messi juara piala dunia qatar kota argentina buenos aires laut manusia raya hasil lionel messi cs baik piala dunia
860,piala dunia qatar lahir argentina juara piala dunia nanti piala dunia
861,selamat timnas argentina hasil juara pesta sepak bola dunia
862,bayern munchen murka kingsley coman sasar rasial gagal qatar
863,latih sukses bawa argentina juara copa america piala dunia
864,sejarah trofi piala dunia piala dunia resmi minggu desember argentina juara
865,momen sakral saji lionel messi raya hasil timnas argentina juara piala dunia qatar raya lionel messi foto anak sergio aguero cucu ego armando maradona benjamin aguero
867,perintah argentina tetap selasa tanggal desember libur nasional raya sukses timnas juara qatar
869,deepika padukone bawa trofi piala dunia jelang final argentina prancis stadion lusail doha qatar
872,sang juara arak keliling buenos aires argentina
873,sumber the nielsen company indonesia olah data inews research
874,terima kasih pirsa inews tonton inews malam program berita tonton tayang seninminggu wib tonton berita utama formasi main argentina versus prancis laga piala dunia qatar
875,reaksi publik jubah kena lionel messi angkat trofi piala dunia qatar surabaya insider
876,antonella roccuzzo wanita hebat balik sukses lionel messi
879,pesan kakanwil kemenkumham faisol ali piala dunia qatar faisol ali
882,piala dunia qatar suap petinggi fifa mati kerja bangun stadion infrastruktur isu palestina tanding gagal raksasa eropa qatar larang lgbt wine dll
883,menontonbareng juara piala dunia fifa world cup qatar argentina vs prancis
884,pro kontra jubah tradisional arab bisht pakai lionel messi angkat trofi piala dunia laku jual qatar laga final
885,bismillah moga untung juara piala dunia kali piala dunia argentina top scorer mario kempes gol piala dunia mexico top scorer ego armando maradona gol piala dunia qatar top scorer lionel messi gol
887,intuisi bohong uji coba kali akurat tebak piala dunia qatar
888,juara piala dunia argentina peringkat ranking baru fifa
889,gaya lionel messi angkat trofi piala dunia qatar debat sang kapten argentina kena jubah arab netizen anggap canggung
890,lionel messi sangkut kabel lintang raya timnas argentina juara piala dunia
891,scaloni putus main dybala sang main pulih cedera
892,carlo ancelotti ronaldo lanjut karier timur
893,bagi hadiah serta piala dunia argentina besar jerman ngenes
894,pekanbaru desember ikut gelar piala dunia qatar
895,sukses qatar helat piala dunia lecut menteri badan usaha milik negara bumn erick thohir indonesia tuan rumah piala dunia lu sama
897,senyum bahagia lionel messi angkat trofi piala dunia qatar cristiano ronaldo tangis nasib masuk daftar main forma buruk turnamen
899,sedih ya soccer mania legend sepakbola piala dunia sports
900,serama bookie judi piala dunia qatar tahan polis op moga ix jalan november kelmarin
902,lionel messi timnas argentina buenos aires
903,video timnas argentina arak raih gelar juara piala dunia qatar
904,selamat tinggal piala dunia qatar selamat aff coba kasih harap timnas aff kali
906,raya menang piala dunia qatar fan argentina cium kening tugas aman viral lengkap via
907,timnas argentina resmi juara piala dunia partai final kalah prancis selamat argentina
908,video baru nawacita tv moment messi team argentina menang piala dunia qatar
909,kali juara piala dunia juara piala dunia argentina mexico qatar mario kempes gol ego maradona gol lionel messi gol
910,fakta balik jubah kena messi terima trofi piala dunia sports
911,raya pesta dunia qatar kali laksana wilayah jazirah arab gugur sejarah fakta tarik laksana nov des
912,perintah argentina umum libur nasional selasa raya menang piala dunia tiga albiceleste qatar
913,pecah pesta final piala dunia qatar bareng aice riah
915,majalah bisnis minggu amerika pilih korea runnerup tanding soft power piala dunia qatar
916,teknologi offside semiotomatis kali kenal piala dunia qatar inspirasi piala dunia ria a putus teknologi sisa musim
918,uni stadion piala dunia qatar
919,duel messi vs mbappe final piala dunia qatar sejarah
921,aku menang piala dunia gaya main lionel messi ego maradona
922,percaya argentina juara piala dunia jimat gelang merah pakai cristian gonzales
924,remeh mainmain messi juara piala dunia sports
925,fifa world cup qatar momen lupa messi hasil menang turnamen piala dunia
927,gelar piala dunia dunia qatar tuan rumah efektif promosi wajah indah ajar islam
928,daftar rekor toreh gelar piala dunia qatar
930,jakarta cnn indonesia lionel messi kawankawan argentina pulang piala dunia qatar bawa trofi juara
932,tuai kecam publik qatar buka suara beri jubah bisht lionel messi piala dunia lengkap via
935,video baru nawacita tv laut manusia turun jalan sambut timnas argentina menang piala dunia qatar
936,raja salmanmbs emir qatar piala dunia selamat sukses
937,gampang prediksi piala dunia fase grup amp tebak juara nya piala dunia amat bola tebak nebak juara piala dunia qatar amp messi
939,paspalum vaginalum paspalum pantai jadi rumput lapang sepak bola jenis rumput tangguh ajang piala dunia qatar
940,alexis mac allister auto rebut klub gemilang qatar brighton ketarketir tuh
941,pasu argentina trofi piala dunia tang kali tiga doha qatar ahad selamat darat buenos aires lepas mengharungi jalan jam
942,pecah tonton bareng teroooss jakarta saksi messi angkat trofi piala dunia qatar
943,menpora erick thohir temu presiden fifa qatar bahas piala dunia lu
944,akun instagram messi hujan followers kemenanganny piala dunia qatar
945,piala dunia qatar world cup fantasy league tatatengah klasemen final liga
946,hasil messi ronaldo milik followers instagram dunia gerak selamat
947,palestina juara piala dunia qatar
948,eks tandem maradona messi hebat layak juara piala dunia
950,argentina umum libur nasional raya gelar piala dunia
951,bantu sihir hasil messi juara piala dunia
952,fifa rilis capai individu pasca gelar piala dunia qatar
953,main incar klub eropa pasca piala dunia qatar kiprah via
954,piala dunia selesai puas sih pildun kali tanding menang debat cinta sepak bola the real goat wkwk ishowspeed bikin pildun seru
956,deret menang harga piala dunia antar harga rebut argentina saja terima harga sports
957,piala dunia rodrigo deh paul prediksi argentina juara
958,qatar bawa baru teknologi piala dunia salah satu bola teknologi connected ball kepo yuk canggih
959,mari nikmat momen manis qatar sembari songsong piala dunia amerika utara selamat tinggal qatar jumpa amerika utara
960,main argentina aksi lucah lepas terima pingat undang kecam jaga gol argentina emiliano martinez sahaja curi tumpu lawan piala dunia qatar tentang perancis malam aksi tangkas
961,gol messi lawan prancis absah
962,momen ikonik pascafinal piala dunia salah satu momen lionel messi kena jubah arab presiden fifa emir qatar sosok pakai lionel messi jubah hitam nama bisht
964,ilmu dekat islam qatar dekat islam metode dekat normatif strategi qatar kenal ajar islam piala dunia
965,berita baru teknologi canggih gelar piala dunia qatar cek berita lengkap
966,sukses qatar helat piala dunia lecut semangat menteri bumn bawa indonesia tuan rumah piala dunia lu buat level qatar indonesia
967,ucap pimpin hasil argentina juara piala dunia qatar
968,timnas argentina selasa darat bandara internasional ministro pistarini ezeiza buenos aires lionel messi kawankawan sambut laut warga argentina hadir juara piala dunia qatar
969,politis partai golkar jago argentina juara piala dunia qatar dedi mulyadi anggota dpr ri indah putri indriani bupati luwu utara ahmed zaki iskandar bupati tangerang agun gunandjar sudarsa anggota dpr ri
970,juara mah bebas presiden argentina alberto fernandez umum tanggal desember sebagia libur nasional lionel messi dkk juara piala dunia qatar
971,prancis sambut hangat gagal qatar
972,piala dunia qatar gelar olimpiade
973,saudara cristiano ronaldo piala dunia buruk selamat argentina
974,bendera palestina kibar dukung negara ras qatar jelang piala dunia ratus suporter sepak bola kibar bendera palestina
975,sebelas main baik piala dunia qatar versi admin versi
976,emiliano martinez gera cabul terima golden glove final piala dunia qatar argentina tekuk juara tahan prancis
978,polis johor tahan bookie judi piala dunia qatar nilai taruh lebih rm juta ringgit
980,beda final megah final baik final baik pegang fakta sejarah fifa coba wikipedia situs resmi fifasementara piala dunia megah serta final idama qatar mana tim maroko sejarah tim afrika baik
981,qatar tuan rumah hasil hadir dakwah islam indonesia tuan rumah hadir dukun rara
982,congratulation qatar best world cup ever
983,piala dunia negara libur nasional kalah argentina
984,demam piala dunia jersey timnas maroko jual habis jelang laga semifinal qatar
985,padat rayap ramai duduk argentina juara piala dunia qatar
986,tuai kecam publik qatar buka suara beri jubah bisht lionel messi piala dunia
988,piala argentina juara piala dunia qatar hadiah uang milyar
991,rakyat argentina sambut pulang pahlawan gores tinta emas piala dunia qatar presiden alberto fernandez umum sambut lionel messi dkk libur nasional
992,jejak argentina cetak mega bintang lapang hijau
993,fakta unik tarik kompetisi piala dunia qatar
997,alas qatar bisht messi seremoni juara piala dunia cnn indonesia google berita olahraga
998,yess topik piala dunia tarik tulis ancang tulis pildun
999,lionel messi main argentina angkat trofi piala dunia juara piala dunia lusail stadium qatar senin
1000,main psg tampil ciamik piala dunia qatar salah lionel messi kylian mbappe performa presiden psg tawar panjang kontrak lionle messi kylian
1001,sukses qatar tuan rumah piala dunia patut contoh indonesia tuan rumah piala dunia lu erick thohir
1002,posting instagram messi raya menang argentina prancis final piala dunia qatar minggu desember unggah atlet suka sejarah instagram
1003,javier zanetti lionel messi lampau ego maradona
1005,antonela roccuzzo istri lionel messi curi perhati hadir serah trofi piala dunia qatar
1006,argentina juara piala dunia kalah arab saudi juara sejati qatar arab saudi
1009,pesan mbappe prancis gagal juara piala dunia qatar
1010,rakyat prancis kumpul kota paris sambut pulang mbappe cs piala dunia qatar sorak sorai nyala flarecahaya ponsel
1011,unik legenda ac mil raya menang lionel messi rebut piala dunia qatar nyemplung kolam
1012,bruno fernandes casemiro harry maguire pilih xi baik turnamen piala dunia qatar
1013,gagal gabung timnas piala dunia skuad juara dunia perancis skorsing hilang momentum pildun cedera wak haji benzema putus gantung sepatu sepakbola internasional
1014,kabar batitusta ballboy nya argentina fwc qatar resmi milik medali piala dunia hak raya squad argentina
1015,selamat menang argentina piala dunia
1016,argentina menang piala dunia
1017,alas bawa barang jadi kenangkenangan
1018,maxi rodriguez eks liverpool daftar kitman argentina world cup qatar resmi milik medali piala dunia hak raya squad argentina cerita media sumber keitas hamstring
1019,gemerlap pesta puncak piala dunia riah deret sohor nama tonton partai final langsung doha qatar
1020,kali juara dunia piala dunia argentina kali raih gelar juara meksiko gelar juara argentina juara piala dunia qatar
1021,jurulatih alam carlo ancelotti tolak desasdesus latih pasu brazil singkir peringkat suku piala dunia qatar
1022,tim buruk piala dunia qatar
1023,chemistry erdogan elon musk presiden turki erdogan jabat tangan elon musk temu piala dunia qatar
1024,dembele giroud main buruk prancis final piala dunia
1025,aff champhionship selasa november
1026,erick thohir contoh selenggara ajang piala dunia qatar world cup lu
1027,helat piala dunia qatar argentina juara dunia menteri bumn contoh qatar selenggara world cup lu indonesia
1028,menang argentina piala dunia bukti lionel messi goat sungguh sports
1029,piala dunia qatar negara stadion gelar sama mana sistem tanding kayak
1033,pasal helat qatar teknologi baru negaranegara selenggara piala dunia totalitas ya flouman kirakira teknologi piala dunia
1034,piala dunia resmi teknologi tuan rumah selenggara piala dunia qatar nanggungnanggung
1037,terima kasih juta rakyat malaysia tonton lawan piala dunia qatar terusi rtmklik sahih berita rtm
1038,kenal sosok emir qatar gelontor rp triliun piala dunia
1039,tirai kompetisi sepakbola besar dunia resmi tutup piala dunia fifa qatar selesai argentina juara hikmah petik hubung erat hidup utas
1040,update member turnament piala dunia qatar bonus new member deposit dana ovo gopay link deposit pulsa potong hubung wa
1041,kali tim detikcom sempat liput piala dunia qatar liput peristiwa tarik lucu rangkum piala dunia qatar
1042,mini pocket mancis edisi spesial world cup sni import filipin redi
1044,alas qatar bisht messi seremoni juara piala dunia
1045,timnas maroko tanding piala dunia ranking fifa brasil posisi atas finis empat final qatar
1046,total gol piala dunia qatar total gol sejarah piala dunia lewat rekor gol piala dunia seru
1050,makna jubah bisht emir qatar lionel messi argentina juara piala dunia
1051,andres iniesta bangga jaya lionel messi piala dunia
1052,euforia menang messi argentina piala dunia qatar gegapgempita jubah bisht pakai emir qatar messi kontroversi
1053,puji teguh prinsip qatar tahan nilainilai budaya mantan presiden inter mil nilai qatar hasil modernisasi hilang adat istiadat penyelengaraan piala dunia
1056,terima kasih juta rakyat malaysia tonton johan piala dunia qatar terusi rtmklik baik
1057,argentina juara fifa world cup qatar timnas argentina resmi juara piala dunia partai final kalah prancis simak berita lengkap klik link
1058,artis india deepika padukone bawa trofi piala dunia curi perhati deepika damping mantan kiper kapten spanyol iker casillas tampil trofi pildun lapang hijau cantik banget
1059,pandang indah menara al jaber kota lusail qatar bendera palestina hias menara hari final piala dunia qatar
1060,latih lionel scaloni pegang peran hasil argentina tang piala dunia qatar
1061,orang tolol dunia lihat komentar qatar piala dunia open minded pikir buka pikir stuuu lgbtq people
1064,sembang santai ybtm kbs belia melaka riah sempena lawan piala dunia qatar
1065,argentina sukses juara piala dunia tim tango kali juara piala dunia kirakira ya sob bendera indonesia daftar menang piala dunia
1066,harga bisht qatar lambung pakai lionel messi angkat trofi piala dunia via
1067,pildun bentar messi cs piala dunia gua
1068,terima kasih juta rakyat malaysia tonton lawan piala dunia qatar terusi rtmklik sahih berita rtm langkawifm rtm
1069,argentina congrats doha qatar
1071,pasca raih gelar juara piala dunia tim argentina lionel messi menep kabar pensiun angkat trofi emas qatar berita
1072,media barat jujur selenggara piala dunia qatar
1073,gelar piala dunia qatar bikin youtuber betah cebok pakai air
1074,yeayyy argentina juara piala dunia qatar prediksi jago nih erick thohir aku inspirasi qatar tuan rumah terap pas indonesia tuan rumah world cup lu
1075,terima kasih juta rakyat malaysia tonton lawan piala dunia qatar terusi rtmklik baik
1076,lionel messi hasil bawa argentina juara piala dunia cristiano ronaldo ejek netizen
1077,piala dunia qatar ragu selenggara piala dunia qatar bukti stigma patah
1078,cerita selamat super emiliano martinez
1079,ronaldo sanjung lionel messi bawa argentina juara piala dunia
1080,top skor piala dunia rahasia bugar mbappe
1081,cuplik golgol baik piala dunia qatar
1082,muncul debat syekh lionel messi pakai jubah arab
1083,lequipe nilai prancis tendang bebas alihalih bobol
1084,selamat tim nasional marroko prestasi piala dunia qatar mendungkung
1085,latih lionel scaloni final gila argentina
1086,piala dunia gelar negara gebyar piala dunia qatar argentina raih gelar juara tunduk prancis adu penalti stadion lusail minggu
1087,cetak hattrick final piala dunia gin besar gaji mbappe musim
1088,menang piala dunia ya qatar heboh qatar selenggara dbanding puncak world cup lu deserve qatar had dunyya hubung
1089,takluk argentina lioris kalah duel tinju
1090,karim benzema kena seragam prancis putus pensiun tim nasional prancis gagal tampil piala dunia qatar
1091,romy ury rafael sukses prediksi juara piala dunia qatar bantah bantu jin
1094,emiliano martinez kiper baik piala dunia qatar alas balik selebrasi vulgar
1096,kunci sukses qatar tuan rumah piala dunia
1097,aktivis palestin munafik elkurd kibar bendera palestin lawan piala dunia qatar
1098,piala dunia qatar argentina juara sempat langsung tonton tribun tamu undang inspirasi contoh qatar indonesia mjd tuan rumah piala dunia lu
1099,argentina sukses raih trofi juara piala dunia lapang suporter dukung qatar jalan ritual
1100,singkat ancam komentar mbappe prancis kalah argentina final piala dunia
1101,indihome gelar menontonbareng bareng fina piala dunia qatar economic zone rangkai event tonton bareng teroooss gelar indihome sponsor lokal fifa world cup qatar pasuk kota iring piala dunia
1102,paulo dybala full senyum menang argentina prancis partai final piala dunia sports
1103,larang tampil seksi fan cewek argentina ramairamai buka baju telanjang dada final piala dunia lolos hukum qatar
1104,cerita youtuber betah cebok pakai air bulan tonton piala dunia qatar
1105,trivia jubah tradisional bisht hadiah lionel messi tanda pahlawan jaya bantu argentina muncul juara piala dunia qatar
1106,emiliano martinez jago adu penalti pahlawan argentina testimoni sih mantan latih
1107,juara piala dunia qatar argentina dipermalukanpulang bawa piala situs slot online amp parlay
1109,main sinar piala dunia qatar messi
1110,nyanyi hijab qatar tampil tutup piala dunia nyanyi nama aisha milik misi inspiratif tampil
1111,daftar terima harga piala dunia qatar main timnas argentina dominasi
1113,kylian mbappe lampau lionel messi baik dunia
1114,timnas sepak bola argentina arak raih piala dunia qatar argentina juta warga raya menang tim tango berita
1116,menang argentina prancis final piala dunia qatar nilai cinta sepak bola bukti lionel messi sepak bola baik lebih cristiano ronaldo berita
1117,sokong penuh place deh concorde paris sambut pasu bawa situ lepas darat lapang terbang qatar
1118,cetak gol tanding piala dunia qatar cetak hattrick final piala dunia usia menang sepatu emas toreh gol bawa prancis backtoback final piala dunia
1121,argentina menang piala dunia angkat trofi lionel messi kena jubah hitam jubah nama bisht emir qatar sheikh tamim bin hamad al thani
1122,piala dunia hasil qatar tuan rumah
1124,adidas luncur bola tanding resmi semifinal final piala dunia qatar
1125,bangga lionel messi menang trofi piala dunia qatar campeones del mundo ragam indonesia
1126,resmi simak fakta tarik piala dunia qatar alkohol ragam indonesia
1127,laga argentina vs prancis final piala dunia qatar pecah rekor cari google ceo google sundar pichai sebut cari final piala dunia qatar raih trafik tinggi
1128,detikers tahu piala dunia qatar catat rekor turnamen sepak bola gelar
1131,catat sih pai piala dunia qatar
1132,dukung sambut riah skuad timnas maroko ukir catat sejarah piala dunia qatar
1133,piala dunia qatar catat rekor turnamen sepak bola akbar gelar
1135,jung kook bawa lagu fifanya dreamers fahad al bais upacara buka piala dunia fifa ada tanding kickoff qatar ekuador stadion al bayt november
1136,upacara buka piala dunia november stadion al bayt al khor qatar army gelisah jung kook muncul panggung septet kpop teman
1138,sukses qatar helat piala dunia lecut menteri bumn erick thohir indonesia tuan rumah piala dunia lu sama indonesia
1140,timnas argentina arak raih gelar juara piala dunia qatar liput
1141,kim jong un piala dunia protes isu ham qatar
1143,event piala dunia qatar saksi aparat aman tindak represif dalam luar stadion salut
1144,timnas argentina juara piala dunia qatar unggah lionel messi instagram pecah rekor
1146,deret main mls angkat trofi piala dunia
1147,sepurane cak telat update juara piala dunia qatar
1148,starting xi premier league pukau piala dunia
1150,sember jabat pengerusi jawatankuasa komunikasi multimedia ngo negeri perak kerjasama digital perak agens pknp jabat siar perak anjur tayang lawan piala dunia fifa qatar tempat
1152,hasil argentina juara piala dunia qatar sambut sukacita juta warga argentina dhaka bangladesh tim tango hadir bahagia sulit ekonomi derita
1153,kali ikut piala dunia benerbener ikut qatar hafal main skor cetak gol
1155,amat juang argentina piala dunia spanyol
1157,juara piala dunia qatar argentina jaya potong duduk belgium duduk ranking fifa dunia
1158,jadwal piala dunia qatar perancis lolos
1159,alas deschamps tarik giroud
1160,tipsy tuesday live dj and band december contact us for more info
1161,unggah foto angkat trofi piala dunia messi pecah rekor instagram
1162,media siar amerika cnn sports pilih lapor fotofoto baik piala dunia jungkook pilih foto baik piala dunia upacara buka piala dunia fifa qatar
1163,timnas perancis sambut orang paris gagal bawa pulang trofi emas piala dunia qatar
1164,insiden serah tropi piala dunia qatar kemarin emir qatar bersitegang kait macron
1165,arrigo sacchi messi banding maradona
1166,messi peran sukses langkah argentina takhta piala dunia qatar mbappe pimpin generasi
1167,piala dunia fifa qatar bicara media sosial messi ronaldo mbappe jungkook neymar
1168,benzema panggil timnas france argentina juara piala dunia qatar
1169,tonton rumah menontonbareng keluarga rumah joko menontonbareng galih mal jababeka menontonbareng galih ruko jababeka menontonbareng keluarga rumah orangtua tonton rumah menontonbareng bapack bapack rumah agus
1170,piala dunia fifa qatar bicara media sosial messi ronaldo mbappe jungkook neymar im love with of si new single dreamers for the
1171,lionel scaloni andai ego maradona
1172,putus lepas serang real madrid lepas peluang bantu perancis pentas piala dunia qatar akibat cedera
1173,transit qatar at doha des h final piala dunia des hype nya world cup lihat fan argentina prancis bandara bismillah umroh arab saudi madinah amp makkah moga teman berangkat umroh
1174,reaksi legenda final piala dunia
1178,terima kasih piala dunia qatar
1179,urut juara piala dunia qatar arab saudi argentina perancis kroasia
1180,runnerup top skor mbappe tuju
1181,argentina juara piala dunia qatar
1182,nama settingan piala dunia qatar narasinarasi negatif bangun sosial media cuci otak seolaholah qatar sukses selenggara piala dunia sukses hebat
1183,argentina sikat prancis messi pamer trofi piala dunia suarez
1185,kisah cinta messi antonella roccuzzo taksir umur
1186,menteri kabinet presiden joko widodo jokowi kunjung kerja qatar jelang final piala dunia menteri bumn erick thohir menteri hubung budi karya sumadi
1188,juta rakyat argentina hadap krisis ekonomi akibat inflasi raya hasil tim nasional juara piala dunia qatar sepak bola lipur derita hidup ekonomi warga
1189,berkat kreativitas netizen foto selebrasi messi persis maradona ikut ronaldo lho
1191,polisi prancis bentrok gemar sepak bola tanding piala dunia minggu malam desember timnas prancis kalah argentina piala dunia qatar whatsapp
1193,kylian mbappe lampau lionel messi
1194,momen peluk sang messi juara piala dunia
1196,piala dunia selesai kerja migran qatar takut
1197,karim benzema putus pensiun timnas prancis
1198,kalah kylian mbappe dkk hadap argentina babak final piala dunia qatar picu bentrok paris
1200,pegang trofi piala dunia chef salt bae tuai kecam
1201,final piala dunia baik drama qatar urut swiss aguero ehsan autumn paris champions league lloris messi
1202,qatar terima kunjung juta orang piala dunia angka pasti pesta
1203,qatar piala dunia juara menang angkat piala dunia go tengo tim argentina
1204,lionel messi kalah ferancis partai final argentina juara piala dunia fifa adu penalti stadion lusial qatar senin wib sejarah gelar tiga argentina
1205,argentina juara piala dunia buenos aires gila
1206,bak kisah dongeng emi martinez debut timnas gelar juara
1207,foto momen mesar lionel messi antonela roccuzzo selebrasi juara piala dunia
1208,tampak wajah kota doha riah pesta piala dunia qatar
1209,bintang argentina juara piala dunia tiga kali
1210,reaksi skuad argentina media sosial juara piala dunia messi
1212,gila piala dunia qatar ringkas video
1213,lionel messi kena bisht upacara tutup piala dunia qatar makna
1214,fakta unik piala dunia qatar momen langka
1215,hikmah piala dunia qatar negara tumben tahan melek tonton hapal namanama bintang negara laga fase grup final nama bumbu amp ikan konsumsi favorit keluarga
1217,pele ucap selamat argentina juara piala dunia
1218,piala dunia qatar
1219,piala dunia qatar pecah rekor gol
1220,prancis tim rating tinggi piala dunia
